tweet_id,source,text,rating_numerator,rating_denominator,name,stage,jpg_url,img_num,p1,p1_conf,p1_dog,p2,p2_conf,p2_dog,p3,p3_conf,p3_dog,favorite_count,retweet_count,post_time,post_date
742528092657332225,iPhone,This is Maxaroni. He's pumped as hell for the summer. Been working on his beach bod for so long. 10/10 https://t.co/UHvjxm9B0O,10,10,Maxaroni,,https://pbs.twimg.com/media/Ck39W0JWUAApgnH.jpg,2,sunglasses,0.900864,False,sunglass,0.0402906,False,snorkel,0.00933292,False,3997,1770,01:24:27,2016-06-14
742423170473463808,iPhone,This is Bell. She likes holding hands. 12/10 would definitely pet with other hand https://t.co/BXIuvkQO9b,12,10,Bell,,https://pbs.twimg.com/media/Ck2d7tJWUAEPTL3.jpg,1,pug,0.99731,True,Brabancon_griffon,0.00118563,True,French_bulldog,0.000427989,True,8843,3357,18:27:32,2016-06-13
742385895052087300,iPhone,This is Phil. That's his comfort stick. He holds onto it whenever he's sad. 11/10 don't be sad Phil https://t.co/ULdPY6CLpq,11,10,Phil,,https://pbs.twimg.com/media/Ck18CFcXIAAUWoy.jpg,1,Cardigan,0.5669109999999999,True,Border_collie,0.117566,True,Appenzeller,0.047664,True,6112,1741,15:59:24,2016-06-13
742161199639494656,iPhone,This is Doug. He's trying to float away. 12/10 you got this Doug https://t.co/bZaHC3lvTL,12,10,Doug,,https://pbs.twimg.com/media/CkyvqnNWYAQxQY1.jpg,1,balloon,0.990736,False,punching_bag,0.00475356,False,parachute,0.000435974,False,3910,1224,01:06:33,2016-06-13
742150209887731712,iPhone,This is Edmund. He sends stellar selfies. Cute af. 8/10 would totally snapchat with this pupper https://t.co/PprXoqZuKY,8,10,Edmund,pupper,https://pbs.twimg.com/media/CkylrVWWsAAiXJE.jpg,1,Siamese_cat,0.112413,False,French_bulldog,0.0714143999999999,True,hog,0.0624654,False,4585,1376,00:22:53,2016-06-13
741743634094141440,iPhone,Meet Aqua. She's a sandy pupper. Not sure how she feels about being so sandy. Radical tongue slip. 11/10 petable af https://t.co/rYxJ0UQtbE,11,10,Aqua,pupper,https://pbs.twimg.com/media/Cksz42EW0AAh2NF.jpg,1,Labrador_retriever,0.786089,True,flat-coated_retriever,0.0486524,True,Chesapeake_Bay_retriever,0.0346933,True,7380,2455,21:27:17,2016-06-11
741438259667034112,iPhone,This is Tucker. He's still figuring out couches. 9/10 keep your head up pup https://t.co/pXU77HPbJ5,9,10,Tucker,,https://pbs.twimg.com/media/CkoeKTPWYAAcWmo.jpg,1,Chesapeake_Bay_retriever,0.292675,True,redbone,0.197858,True,vizsla,0.150312,True,3333,736,01:13:51,2016-06-11
741303864243200000,iPhone,This is Theodore. He just saw an adult wearing crocs. Did him a frighten. Lost other ear back in nam. 12/10 hero af https://t.co/O4iw9NlLaQ,12,10,Theodore,,https://pbs.twimg.com/media/Ckmj7mNWYAA4NzZ.jpg,1,Chihuahua,0.7681560000000001,True,pug,0.0149016,True,Pekinese,0.0128157999999999,True,7911,2861,16:19:48,2016-06-10
740995100998766593,iPhone,This is Leo. He's a vape god. Blows o's for days. Probably drives a Subaru. Definitely owns multiple fedoras. 10/10 https://t.co/nt2x3fHaRJ,10,10,Leo,,https://pbs.twimg.com/media/CkiLHCjUUAAPwUr.jpg,1,malamute,0.454363,True,Samoyed,0.215967,True,Siberian_husky,0.0775003,True,5684,2420,19:52:53,2016-06-09
740699697422163968,iPhone,This is Chip. He only mowed half the yard. 8/10 quit the shit Chip we have other things to do https://t.co/LjzZKQ7vmK,8,10,Chip,,https://pbs.twimg.com/media/Ckd-bqVUkAIiyM7.jpg,1,lawn_mower,0.878863,False,swing,0.0245351,False,barrow,0.0195772,False,2572,694,00:19:04,2016-06-09
740676976021798912,iPhone,"Meet Baloo. He's expecting a fast ground ball, hence the wide stance. Prepared af. 11/10 nothing runs like a pupper https://t.co/sMbMw5Z2XC",11,10,Baloo,pupper,https://pbs.twimg.com/media/Ckdpx5KWsAANF6b.jpg,1,wombat,0.462952,False,Norwegian_elkhound,0.275225,True,Siamese_cat,0.0435593,False,16398,6101,22:48:46,2016-06-08
740359016048689152,iPhone,This is Chase. He's in a predicament. 9/10 help is on the way buddy https://t.co/0HmBk5sSbW,9,10,Chase,,https://pbs.twimg.com/media/CkZImGVUoAAwv0b.jpg,1,golden_retriever,0.8636870000000001,True,kuvasz,0.0485901,True,Labrador_retriever,0.0473966,True,2980,783,01:45:19,2016-06-08
739979191639244800,iPhone,This is Nollie. She's waving at you. If you don't wave back you're a monster. She's also portable as hell. 12/10 https://t.co/7AKdkCOlMf,12,10,Nollie,,https://pbs.twimg.com/media/CkTvJTdXAAAEfbT.jpg,1,Irish_water_spaniel,0.2858,True,wig,0.240653,False,toy_poodle,0.0749138999999999,True,17988,5271,00:36:02,2016-06-07
739932936087216128,iPhone,Say hello to Rorie. She's zen af. Just enjoying a treat in the sunlight. 10/10 would immediately trade lives with https://t.co/yctnFptdQ1,10,10,Rorie,,https://pbs.twimg.com/media/CkTFEe-W0AA90m1.jpg,1,redbone,0.243904,True,beagle,0.210975,True,vizsla,0.076443,True,3637,961,21:32:13,2016-06-06
739844404073074688,iPhone,This is Simba. He's the grand prize. The trophy is just for participation. 12/10 would pet so damn well https://t.co/4qiuC0lXq5,12,10,Simba,,https://pbs.twimg.com/media/CkR0jrhWYAALL5N.jpg,1,toy_poodle,0.342397,True,table_lamp,0.104451,False,miniature_poodle,0.079871,True,3436,774,15:40:26,2016-06-06
739606147276148736,iPhone,Meet Benji. He just turned 1. Has already given up on a traditional pupper physique. Just inhaled that thing. 9/10 https://t.co/sLUC4th3Zj,9,10,Benji,pupper,https://pbs.twimg.com/media/CkOb3FXW0AAUL_U.jpg,3,Blenheim_spaniel,0.933755,True,cocker_spaniel,0.0417194,True,Brittany_spaniel,0.00671256,True,4855,1474,23:53:41,2016-06-05
739485634323156992,iPhone,This is Kyle. He's a heavy drinker and an avid pot user. Just wants to be pupular. 6/10 I can't support this Kyle https://t.co/rRULp7XFnO,6,10,Kyle,,https://pbs.twimg.com/media/CkMuP7SWkAAD-2R.jpg,2,Walker_hound,0.640256,True,English_foxhound,0.2297989999999999,True,beagle,0.037754,True,6435,2597,15:54:48,2016-06-05
738885046782832640,iPhone,This is Charles. He's a Nova Scotian Towel Pouncer. Deadly af. Nifty tongue slip. 11/10 would pet with caution https://t.co/EfejX3iRGr,11,10,Charles,,https://pbs.twimg.com/media/CkEMBz9WYAAGLaa.jpg,1,bath_towel,0.8783200000000001,False,swab,0.0206333,False,American_Staffordshire_terrier,0.0155351,True,3410,1020,00:08:17,2016-06-04
738537504001953792,iPhone,This is Bayley. She fell asleep trying to escape her evil fence enclosure. 11/10 night night puppo https://t.co/AxSiqAKEKu,11,10,Bayley,puppo,https://pbs.twimg.com/media/Cj_P7rSUgAAYQbz.jpg,1,chow,0.808737,True,gibbon,0.0289424,False,Pembroke,0.0264979,True,4589,1366,01:07:16,2016-06-03
738166403467907072,iPhone,This is Axel. He's a professional leaf catcher. 12/10 gifted af https://t.co/P8bgOMMTRs,12,10,Axel,,https://pbs.twimg.com/media/Cj5-aUQUgAAb43p.jpg,2,keeshond,0.8788860000000001,True,Norwegian_elkhound,0.0866594,True,malamute,0.0212803,True,7888,2983,00:32:39,2016-06-02
738156290900254721,iPhone,This is Storkson. He's wet and sad. 10/10 cheer up pup https://t.co/nrzvzPuTvC,10,10,Storkson,,https://pbs.twimg.com/media/Cj51Oj3VAAEVe4O.jpg,1,pug,0.751758,True,tub,0.110748,False,bathtub,0.1041319999999999,False,2226,575,23:52:28,2016-06-01
737826014890496000,iPhone,This is Remy. He has some long ass ears (probably magical). Also very proud of broken stick. 10/10 such a good boy https://t.co/EZx0YjPjPK,10,10,Remy,,https://pbs.twimg.com/media/Cj1I1fbWYAAOwff.jpg,1,vizsla,0.990391,True,Rhodesian_ridgeback,0.00560474,True,Chesapeake_Bay_retriever,0.00286936,True,4703,1576,02:00:04,2016-06-01
737800304142471168,iPhone,This is Bella. She's ubering home after a few too many drinks. 10/10 socially conscious af https://t.co/KxkOgq80Xj,10,10,Bella,,https://pbs.twimg.com/media/Cj0xdMBVAAEbDHp.jpg,1,malamute,0.374682,True,Norwegian_elkhound,0.334853,True,limousine,0.0681732,False,8986,3124,00:17:54,2016-06-01
737322739594330112,iPhone,Say hello to Lily. She's not injured or anything. Just wants everyone to hear her. 9/10 clever af https://t.co/3xqGVH0Dhw,9,10,Lily,,https://pbs.twimg.com/media/Cjt_Hm6WsAAjkPG.jpg,1,guinea_pig,0.148526,False,solar_dish,0.0971828999999999,False,park_bench,0.0593119,False,3242,718,16:40:14,2016-05-30
736736130620620800,iPhone,This is Chadrick. He's gnarly af 13/10 https://t.co/447tyBN0mW,13,10,Chadrick,,https://pbs.twimg.com/media/CjlpmZaUgAED54W.jpg,1,schipperke,0.545502,True,groenendael,0.298622,True,Labrador_retriever,0.0309864,True,3786,1526,01:49:16,2016-05-29
736365877722001409,iPhone,This is Rory. He's extremely impatient. 11/10 settle down pupper https://t.co/e3tfXJLi40,11,10,Rory,pupper,https://pbs.twimg.com/media/CjgYyuvWkAAHU8g.jpg,3,cup,0.473555,False,toy_poodle,0.082606,True,consomme,0.048298,False,3593,1091,01:18:00,2016-05-28
735991953473572864,iPhone,This is Maxaroni. He's curly af. Also rather fabulous. 11/10 would hug well https://t.co/A216OjIdca,11,10,Maxaroni,,https://pbs.twimg.com/media/CjbExRKUoAAs089.jpg,2,cocker_spaniel,0.961643,True,toy_poodle,0.0115468999999999,True,soft-coated_wheaten_terrier,0.00490333,True,3234,1027,00:32:10,2016-05-27
735635087207878657,iPhone,This is Dakota. He hasn't grow into his skin yet. 11/10 would squeeze softly https://t.co/IvFSlNXpgj,11,10,Dakota,,https://pbs.twimg.com/media/CjWANBlVAAAaN-a.jpg,1,pug,0.8918709999999999,True,goose,0.0143766,False,fur_coat,0.00845143,False,5517,2105,00:54:06,2016-05-26
735256018284875776,iPhone,This is Kellogg. He accidentally opened the front facing camera. 8/10 get it together doggo https://t.co/MRYv7nDPyS,8,10,Kellogg,doggo,https://pbs.twimg.com/media/CjQnclkVEAA4pnK.jpg,1,Staffordshire_bullterrier,0.523191,True,French_bulldog,0.3511039999999999,True,doormat,0.0280752999999999,False,3002,795,23:47:49,2016-05-24
735137028879360001,iPhone,Meet Buckley. His family &amp; some neighbors came over to watch him perform but he's nervous af. 9/10 u got this pupper https://t.co/5bdCpPlno9,9,10,Buckley,pupper,https://pbs.twimg.com/media/CjO7OfeWgAAUQy-.jpg,1,Walker_hound,0.413535,True,beagle,0.233891,True,English_foxhound,0.164943,True,2824,864,15:55:00,2016-05-24
734912297295085568,iPhone,This is Jax. He's a literal fluffball. Sneaky tongue slip. 10/10 would pet nonstop https://t.co/9MGouPwQmK,10,10,Jax,,https://pbs.twimg.com/media/CjLuzPvUoAAbU5k.jpg,1,Maltese_dog,0.847292,True,feather_boa,0.0593786,False,Old_English_sheepdog,0.052758,True,2478,463,01:02:00,2016-05-24
734776360183431168,iPhone,This is Livvie. Someone should tell her it's been 47 years since Woodstock. Magical eyes tho 11/10 would stare into https://t.co/qw07vhVHuO,11,10,Livvie,,https://pbs.twimg.com/media/CjJzMlBUoAADMLx.jpg,1,Siberian_husky,0.304902,True,Eskimo_dog,0.155147,True,malamute,0.0509424,True,2265,482,16:01:50,2016-05-23
733828123016450049,iPhone,This is Terry. The harder you hug him the farther his tongue sticks out. 10/10 magical af https://t.co/RFToQQI8fJ,10,10,Terry,,https://pbs.twimg.com/media/Ci8UxxcW0AYgHDh.jpg,2,beagle,0.4723239999999999,True,Walker_hound,0.121779,True,Saint_Bernard,0.11464,True,3220,703,01:13:53,2016-05-21
733822306246479872,iPhone,This is Moose. He's a Polynesian Floofer. Dapper af. 10/10 would pet diligently https://t.co/mVfqRdppTL,10,10,Moose,floofer,https://pbs.twimg.com/media/Ci8Pfg_UUAA2m9i.jpg,1,Lhasa,0.457356,True,Shih-Tzu,0.371282,True,Tibetan_terrier,0.048359,True,3307,904,00:50:46,2016-05-21
733460102733135873,iPhone,This is Hermione. Her face is as old as time. Appears fluffy af tho. 11/10 pretty damn majestic https://t.co/0b41Q4DKCA,11,10,Hermione,,https://pbs.twimg.com/media/Ci3GDeyUoAAKOxn.jpg,1,chow,0.931275,True,beaver,0.0288311,False,dhole,0.017379,False,3779,1122,00:51:30,2016-05-20
732732193018155009,iPhone,This is Ralpher. He's an East Guinean Flop Dog. Cuddly af. 12/10 https://t.co/rVOLuNRpjH,12,10,Ralpher,,https://pbs.twimg.com/media/CiswCQhWYAI5-QW.jpg,1,koala,0.162935,False,Staffordshire_bullterrier,0.127969,True,mongoose,0.096421,False,2176,477,00:39:02,2016-05-18
732726085725589504,iPhone,This is Aldrick. He looks wise af. Also exceptionally fluffy. Only two legs tho (unfortunate). 11/10 would still hug https://t.co/QwiCVLPMNL,11,10,Aldrick,,https://pbs.twimg.com/media/CisqdVcXEAE3iW7.jpg,1,Pomeranian,0.961902,True,Samoyed,0.0242893,True,chow,0.00577178,True,3205,783,00:14:46,2016-05-18
732375214819057664,iPhone,This is Kyle (pronounced 'Mitch'). He strives to be the best doggo he can be. 11/10 would pat on head approvingly https://t.co/aA2GiTGvlE,11,10,Kyle,doggo,https://pbs.twimg.com/media/CinrX2EWkAABDYt.jpg,1,tennis_ball,0.998673,False,basset,0.000547053,True,golden_retriever,0.00035998,True,7261,2249,01:00:32,2016-05-17
732005617171337216,iPhone,This is Larry. He has no self control. Tongue still nifty af tho 11/10 https://t.co/ghyT4Ubk1r,11,10,Larry,,https://pbs.twimg.com/media/CiibOMzUYAA9Mxz.jpg,1,English_setter,0.677408,True,Border_collie,0.052724,True,cocker_spaniel,0.0485719,True,13357,4794,00:31:53,2016-05-16
731285275100512256,iPhone,This is Solomon. He's a Beneroo Cumberflop. 12/10 would hug passionately https://t.co/5phLAnGPTP,12,10,Solomon,,https://pbs.twimg.com/media/CiYME3tVAAENz99.jpg,1,Pembroke,0.967103,True,Cardigan,0.0211264,True,Chihuahua,0.00223107,True,3124,882,00:49:30,2016-05-14
730573383004487680,iPhone,This is Rooney. He can't comprehend glass. 10/10 it'll be ok pupper https://t.co/CnUl2uDBBV,10,10,Rooney,pupper,https://pbs.twimg.com/media/CiOEnI6WgAAmq4E.jpg,2,American_Staffordshire_terrier,0.810158,True,Labrador_retriever,0.0582049999999999,True,Weimaraner,0.0279295,True,4356,1878,01:40:42,2016-05-12
730427201120833536,iPhone,This is Crystal. She's flawless. Really wants to be a frat bro. 11/10 who does she even know here? https://t.co/WyqNFvEulG,11,10,Crystal,,https://pbs.twimg.com/media/CiL_qh0W0AAu5VA.jpg,1,Eskimo_dog,0.682082,True,Siberian_husky,0.289288,True,Staffordshire_bullterrier,0.00877069,True,3129,928,15:59:50,2016-05-11
730211855403241472,iPhone,This is Ziva. She doesn't know how her collar works. 11/10 would totally fix for her https://t.co/K7pthJXjWE,11,10,Ziva,,https://pbs.twimg.com/media/CiI7zVZUoAEzGW7.jpg,1,pug,0.341663,True,Norwegian_elkhound,0.171222,True,German_shepherd,0.1246869999999999,True,3406,944,01:44:07,2016-05-11
730196704625098752,iPhone,This is Charles. He's camera shy. Tail longer than average. Doesn't look overwhelmingly fluffy. 6/10 would still pet https://t.co/rXvcElhoog,6,10,Charles,,https://pbs.twimg.com/media/CiIuBwCUgAAAGbz.jpg,1,hand_blower,0.296145,False,chain_mail,0.262271,False,toilet_seat,0.149497,False,4337,1668,00:43:55,2016-05-11
729854734790754305,iPhone,Say hello to Ollie. He conducts this train. He also greets you as you enter. Kind af. 11/10 would pet so firmly https://t.co/jVxOGKEU0z,11,10,Ollie,,https://pbs.twimg.com/media/CiD3AfkXEAA3S_r.jpg,1,doormat,0.359586,False,china_cabinet,0.0539014,False,passenger_car,0.0526646999999999,False,3620,994,02:05:03,2016-05-10
729823566028484608,iPhone,This is Stefan. He's a downright remarkable pup. 13/10 https://t.co/Ebjt6Y4fMh,13,10,Stefan,,https://pbs.twimg.com/media/CiDap8fWEAAC4iW.jpg,1,kelpie,0.218408,True,Arabian_camel,0.114368,False,coyote,0.0964093,False,3559,1107,00:01:12,2016-05-10
729463711119904772,iPhone,Meet Pupcasso. You can't afford his art. 13/10 talented af https://t.co/f2VUpy4WO0,13,10,Pupcasso,,https://pbs.twimg.com/media/Ch-TXpFXAAAwPGf.jpg,1,German_shepherd,0.829307,True,Doberman,0.0225,True,basenji,0.0211901,True,5201,2057,00:11:16,2016-05-09
728986383096946689,iPhone,"This is Puff. He started out on the streets (first pic), but don't let the new smile fool you, still tough af. 11/10 https://t.co/kiuXRXcg4B",11,10,Puff,,https://pbs.twimg.com/media/Ch3hOGWUYAE7w0y.jpg,2,Maltese_dog,0.95207,True,toy_poodle,0.0272705999999999,True,miniature_poodle,0.00487436,True,2819,728,16:34:32,2016-05-07
728751179681943552,iPhone,This is Flurpson. He can't believe it's not butter. 10/10 https://t.co/XD3ort1PsE,10,10,Flurpson,,https://pbs.twimg.com/media/Ch0LVPdW0AEdHgU.jpg,1,Saint_Bernard,0.48205,True,collie,0.20274,True,borzoi,0.0379758,True,2469,604,00:59:55,2016-05-07
728653952833728512,iPhone,This is Coleman. Somebody needs to tell him that he's sitting in chairs wrong. 8/10 https://t.co/O10zjJ2Ixs,8,10,Coleman,,https://pbs.twimg.com/media/Chyy5lQWUAEzxSL.jpg,2,window_shade,0.594333,False,studio_couch,0.053515,False,rotisserie,0.0412478,False,2993,930,18:33:34,2016-05-06
728409960103686147,iPhone,This is Wallace. He's a skater pup. He said see ya later pup. Can easily do a kick flip. Gnarly af. 10/10 v petable https://t.co/5i8fORVKgr,10,10,Wallace,,https://pbs.twimg.com/media/ChvU_DwWMAArx5L.jpg,1,Siamese_cat,0.478278,False,Saint_Bernard,0.0942456,True,king_penguin,0.0821567,False,4385,1794,02:24:02,2016-05-06
728387165835677696,iPhone,"This is Enchilada (yes, that's her real name). She's a Low-Cruisin Plopflopple. Very rare. Only a few left. 12/10 https://t.co/SiaiTWgsfP",12,10,Enchilada,,https://pbs.twimg.com/media/ChvAQuMWMAAVaKD.jpg,1,collie,0.266414,True,Great_Pyrenees,0.138546,True,keeshond,0.109014,True,3325,862,00:53:27,2016-05-06
728046963732717569,iPhone,This is Raymond. He controls fountains with his tongue. 11/10 pretty damn magical https://t.co/9aMxSbOaAZ,11,10,Raymond,,https://pbs.twimg.com/media/ChqK2cVWMAAE5Zj.jpg,1,Newfoundland,0.255971,True,groenendael,0.175583,True,German_shepherd,0.164135,True,3828,1063,02:21:37,2016-05-05
728015554473250816,iPhone,This is Rueben. He has reached ultimate pupper zen state. 11/10 tranquil af https://t.co/Z167HgtnBi,11,10,Rueben,pupper,https://pbs.twimg.com/media/ChpuRyvVAAARMoq.jpg,1,cocker_spaniel,0.384559,True,golden_retriever,0.091661,True,sandbar,0.0817989,False,3689,974,00:16:48,2016-05-05
727685679342333952,iPhone,This is Cilantro. She's a Fellation Gadzooks. Eyes are super magical af. 12/10 could get lost in https://t.co/yJ26LNuyj5,12,10,Cilantro,,https://pbs.twimg.com/media/ChlCQg-VIAQ_8g4.jpg,1,Border_collie,0.462408,True,collie,0.214556,True,Eskimo_dog,0.0356036,True,2658,560,02:26:00,2016-05-04
727175381690781696,iPhone,This is Karll. He just wants to go kayaking. 10/10 please someone take Karll kayaking already https://t.co/vXLkvyNQHp,10,10,Karll,,https://pbs.twimg.com/media/ChdyJvdWwAA5HGd.jpg,2,flat-coated_retriever,0.656463,True,Great_Dane,0.0847658,True,Labrador_retriever,0.0589085,True,3500,1218,16:38:15,2016-05-02
726935089318363137,iPhone,This is Sprout. He's just precious af. 12/10 I'd do anything for Sprout https://t.co/DxlX1yTVYY,12,10,Sprout,,https://pbs.twimg.com/media/ChaXmuAXEAE66KP.jpg,2,teddy,0.821615,False,toy_poodle,0.083749,True,Lakeland_terrier,0.033318,True,6153,2162,00:43:25,2016-05-02
726887082820554753,iPhone,This is Blitz. He's a new dad struggling to cope mentally with the pressures of being a father. Sick shades 10/10 https://t.co/2AVcJ2BZsy,10,10,Blitz,,https://pbs.twimg.com/media/ChZr8SdWIAAVQKt.jpg,1,soft-coated_wheaten_terrier,0.5159189999999999,True,Irish_terrier,0.162655,True,Chesapeake_Bay_retriever,0.125182,True,3455,1348,21:32:40,2016-05-01
726828223124897792,iPhone,This is Bloop. He's a Phoenician Winnebago. Tongue is just wow. That box is all he has (tragic). 12/10 would caress https://t.co/DWNrPPXgHA,12,10,Bloop,,https://pbs.twimg.com/media/ChY2aHyWMAAbNQE.jpg,1,miniature_pinscher,0.2553269999999999,True,Border_terrier,0.181279,True,Labrador_retriever,0.125185,True,3208,901,17:38:46,2016-05-01
725842289046749185,iPhone,This is Colby. He's currently regretting all those times he shook your hand for an extra treat. 12/10 https://t.co/vtVHtKFtBH,12,10,Colby,,https://pbs.twimg.com/media/ChK1tdBWwAQ1flD.jpg,1,toy_poodle,0.420463,True,miniature_poodle,0.13264,True,Chesapeake_Bay_retriever,0.121523,True,6349,2372,00:21:01,2016-04-29
725786712245440512,iPhone,Say hello to Lillie. She's a Rutabagan Floofem. Poor pupper ate and then passed out. 11/10 relatable af https://t.co/uIdGqug9rw,11,10,Lillie,pupper,https://pbs.twimg.com/media/ChKDKmIWIAIJP_e.jpg,1,chow,0.335761,True,Samoyed,0.167173,True,kuvasz,0.145715,True,3748,1223,20:40:11,2016-04-28
725729321944506368,iPhone,This is Lola. She's a Butternut Splishnsplash. They are known to be ferocious af. 12/10 would absolutely still pet https://t.co/adQt5a6TZU,12,10,Lola,,https://pbs.twimg.com/media/ChJO9YaWYAEL0zC.jpg,1,boxer,0.599076,True,bull_mastiff,0.177318,True,French_bulldog,0.141461,True,4665,1577,16:52:08,2016-04-28
724983749226668032,iPhone,This is Fred-Rick. He dabbles in parkour. The elevation gives him power. 12/10 hopefully visiting a mailbox near you https://t.co/qFqLtudIiD,12,10,Fred,,https://pbs.twimg.com/media/Cg-o3w0WgAANXdv.jpg,1,golden_retriever,0.67575,True,Great_Pyrenees,0.0951679,True,cocker_spaniel,0.0760429,True,3352,1144,15:29:30,2016-04-26
724405726123311104,iPhone,This is Ashleigh. She's having Coachella withdrawals. Didn't even go tho. 10/10 stay strong pupper https://t.co/nRUaKWnJfH,10,10,Ashleigh,pupper,https://pbs.twimg.com/media/Cg2bKLAWwAA0WEm.jpg,1,golden_retriever,0.240695,True,cocker_spaniel,0.202444,True,feather_boa,0.159348,False,4753,1485,01:12:38,2016-04-25
724049859469295616,iPhone,This is Kreggory. He just took a look at his student debt. 10/10 can't even comprehend it https://t.co/XTsZTgilnT,10,10,Kreggory,,https://pbs.twimg.com/media/CgxXf1TWYAEjY61.jpg,1,Border_collie,0.581835,True,collie,0.344588,True,Shetland_sheepdog,0.0435842,True,3867,1587,01:38:33,2016-04-24
724046343203856385,iPhone,"This is Sarge. Not even he knows what his tongue is doing, but it's pretty damn spectacular. 10/10 https://t.co/pIQEdbBxdL",10,10,Sarge,,https://pbs.twimg.com/media/CgxUTS_XEAAC0pv.jpg,1,boxer,0.8262719999999999,True,bull_mastiff,0.158595,True,Great_Dane,0.0118586,True,2394,507,01:24:35,2016-04-24
724004602748780546,iPhone,This is Luther. He saw a ghost. Spooked af. 11/10 hang in there pupper https://t.co/EdKG43VvEl,11,10,Luther,pupper,https://pbs.twimg.com/media/CgwuWCeW4AAsgbD.jpg,3,Siamese_cat,0.950526,False,pug,0.0188769,True,quilt,0.0076276,False,3749,1375,22:38:43,2016-04-23
723912936180330496,iPhone,This is Sugar. She's a Bolivian Superfloof. Spherical af. 12/10 would never let go of https://t.co/AhMfUu6Onm,12,10,Sugar,,https://pbs.twimg.com/media/Cgva-QqUUAA7Hv9.jpg,1,Samoyed,0.991772,True,Pomeranian,0.00362638,True,chow,0.00223183,True,3499,1105,16:34:28,2016-04-23
723688335806480385,iPhone,This is Reginald. He starts screaming at random. 12/10 cuddly af https://t.co/YgNuDQbv89,12,10,Reginald,,https://pbs.twimg.com/media/CgsOszGW0AAruKp.jpg,2,teddy,0.263256,False,chow,0.0890102,True,Irish_terrier,0.0653057,True,6902,2605,01:41:59,2016-04-23
723673163800948736,iPhone,This is Ivar. She is a badass Viking warrior. Will sack your village. 10/10 savage af https://t.co/Dz6MiVssVU,10,10,Ivar,,https://pbs.twimg.com/media/CgsA5eFWgAAu0qn.jpg,1,golden_retriever,0.83939,True,Labrador_retriever,0.0657058,True,hand_blower,0.012941,False,2723,804,00:41:42,2016-04-23
723179728551723008,iPhone,This is Jangle. She's addicted to broccoli. It's the only thing she cares about. Tragic af. 8/10 get help pup https://t.co/8dNWp1cSEa,8,10,Jangle,,https://pbs.twimg.com/media/CglAHjAUgAAfxcq.jpg,1,tennis_ball,0.176495,False,badger,0.0599052,False,Norwegian_elkhound,0.0568505,True,4746,1661,16:00:57,2016-04-21
722613351520608256,iPhone,Meet Schnitzel. He's a Tropicana Floofboop. Getting too big for his favorite basket. 12/10 just so damn fluffy https://t.co/qjd0UJKYUY,12,10,Schnitzel,,https://pbs.twimg.com/media/Cgc9AjMVIAERdUA.jpg,1,Labrador_retriever,0.5309149999999999,True,golden_retriever,0.28823,True,chow,0.0448536999999999,True,4463,1465,02:30:23,2016-04-20
721503162398597120,iPhone,This is Panda. He's happy af. 11/10 https://t.co/IOAk9i4UvE,11,10,Panda,,https://pbs.twimg.com/media/CgNLS1PW8AAxWSN.jpg,3,Pomeranian,0.99775,True,Chihuahua,0.001248,True,Pekinese,0.000775002,True,4138,1616,00:58:53,2016-04-17
721001180231503872,iPhone,This is Oliver. Bath time is upon him. His fear of the wetness postpones his ultimate pupper destiny. 11/10 https://t.co/AFzzKqR4tT,11,10,Oliver,pupper,https://pbs.twimg.com/media/CgGCvxAUkAAx55r.jpg,1,Samoyed,0.950053,True,washbasin,0.00632139,False,tub,0.00624335,False,2289,543,15:44:11,2016-04-15
720785406564900865,iPhone,This is Archie. He hears everything you say. Doesn't matter where you are. 12/10 https://t.co/0l4I8famYp,12,10,Archie,,https://pbs.twimg.com/media/CgC-gMCWcAAawUE.jpg,1,Chihuahua,0.8964219999999999,True,dingo,0.0279294,False,kelpie,0.0179158,True,2781,684,01:26:47,2016-04-15
720775346191278080,iPhone,This is Berkeley. He's in a predicament. 10/10 someone help him https://t.co/XSEXdQupej,10,10,Berkeley,,https://pbs.twimg.com/media/CgC1WqMW4AI1_N0.jpg,1,Newfoundland,0.4899699999999999,True,groenendael,0.174497,True,giant_schnauzer,0.0790666999999999,True,2210,552,00:46:48,2016-04-15
720389942216527872,iPhone,This is Ralphé. He patrols the lake. Looking for babes. 11/10 https://t.co/Pb6iMmo0wk,11,10,Ralphé,,https://pbs.twimg.com/media/Cf9W1J-UMAErahM.jpg,1,Pembroke,0.873977,True,Cardigan,0.0433385,True,Eskimo_dog,0.0191970999999999,True,5717,2219,23:15:21,2016-04-13
720340705894408192,iPhone,This is Derek. He just got balled on. Can't even get up. Poor thing. 10/10 hang in there pupper https://t.co/BIRRF3bcWH,10,10,Derek,pupper,https://pbs.twimg.com/media/Cf8qDFbWwAEf8M3.jpg,1,alp,0.320126,False,lawn_mower,0.0808077,False,viaduct,0.065321,False,2563,854,19:59:42,2016-04-13
720059472081784833,iPhone,This is Charleson. He lost his plunger. Looked everywhere. Can't find it. So sad. 9/10 would comfort https://t.co/pRHX8yn9Yu,9,10,Charleson,,https://pbs.twimg.com/media/Cf4qRcmWEAA9V4h.jpg,1,Mexican_hairless,0.451852,True,redbone,0.254884,True,Italian_greyhound,0.0948181,True,3463,1001,01:22:10,2016-04-13
720043174954147842,iPhone,This is Neptune. He's a Snowy Swiss Mountain Floofapolis. Cheeky wink. Tongue nifty af. 11/10 would pet so firmly https://t.co/SoZq2Xoopv,11,10,Neptune,,https://pbs.twimg.com/media/Cf4bcm8XEAAX4xV.jpg,1,Samoyed,0.954517,True,Eskimo_dog,0.0291296,True,white_wolf,0.00446203,False,4454,1780,00:17:25,2016-04-13
