tweet_id,source,text,rating_numerator,rating_denominator,name,stage,jpg_url,img_num,p1,p1_conf,p1_dog,p2,p2_conf,p2_dog,p3,p3_conf,p3_dog,favorite_count,retweet_count,post_time,post_date
680583894916304897,iPhone,This is Penny. Her tennis ball slowly rolled down her cone and into the pool. 8/10 bad things happen to good puppers https://t.co/YNWU7LeFgg,8,10,Penny,,https://pbs.twimg.com/media/CXHrcFYWcAEE5_L.jpg,1,tub,0.8898010000000001,False,bathtub,0.0323510999999999,False,hippopotamus,0.0141773,False,3226,1170,03:00:19,2015-12-26
680497766108381184,iPhone,Meet Percy. He's a Latvian Yuletide Heineken. Refuses to take off sweater. Kinda feisty. 12/10 would keep in pocket https://t.co/QGM5Fcuv7s,12,10,Percy,,https://pbs.twimg.com/media/CXGdG0aWcAEbOO1.jpg,1,Chihuahua,0.538354,True,muzzle,0.0842887,False,ski_mask,0.0766901,False,3788,1702,21:18:05,2015-12-25
680473011644985345,iPhone,"This is Hector. He thinks he's a hammer. Silly Hector. You're a pupper, not a hammer. 10/10 https://t.co/OdUFuZIXiI",10,10,Hector,pupper,https://pbs.twimg.com/media/CXGGlzvWYAArPfk.jpg,1,Lakeland_terrier,0.796694,True,West_Highland_white_terrier,0.138709,True,Norwich_terrier,0.0162533999999999,True,2295,655,19:39:43,2015-12-25
680221482581123072,iPhone,This is CeCe. She's patiently waiting for Santa. 10/10 https://t.co/ZJUypFFwvg,10,10,CeCe,,https://pbs.twimg.com/media/CXCh0QZW8AALdXm.jpg,1,bubble,0.240173,False,hen,0.146222,False,abaya,0.139342,False,1318,254,03:00:14,2015-12-25
680206703334408192,iPhone,I hope everyone enjoys this picture as much as I do. This is Toby. 12/10 https://t.co/vHnu1g9EJm,12,10,Toby,,https://pbs.twimg.com/media/CXCUYcRW8AAObYM.jpg,1,Christmas_stocking,0.149758,False,cloak,0.12883,False,teddy,0.1091289999999999,False,2526,1019,02:01:30,2015-12-25
680161097740095489,iPhone,Meet Goliath. He's an example of irony. Head is phenomenally round. Wants to be an ornament. 12/10 would hug gently https://t.co/72Dil0Aktw,12,10,Goliath,,https://pbs.twimg.com/media/CXBq6RPWkAAaNuU.jpg,1,bluetick,0.268681,True,miniature_pinscher,0.1256519999999999,True,English_setter,0.0893727,True,2093,651,23:00:17,2015-12-24
680145970311643136,iPhone,Say hello to Kawhi. He was doing fine until his hat fell off. He got it back though. 10/10 deep breaths pupper https://t.co/N5pM6WBx7e,10,10,Kawhi,pupper,https://pbs.twimg.com/media/CXBdJxLUsAAWql2.jpg,1,miniature_poodle,0.457117,True,toy_poodle,0.226481,True,Maltese_dog,0.0676815,True,3229,1532,22:00:10,2015-12-24
680130881361686529,iPhone,This is Reggie. His Santa hat is a little big. 10/10 he's still having fun https://t.co/w0dcGXq7qK,10,10,Reggie,,https://pbs.twimg.com/media/CXBPbVtWAAA2Vus.jpg,1,Maltese_dog,0.199121,True,West_Highland_white_terrier,0.197897,True,Shih-Tzu,0.15713,True,2061,838,21:00:12,2015-12-24
680115823365742593,iPhone,This is Ozzy. He woke up 2 minutes before he had to be ready for the Christmas party. 9/10 classic Ozzy https://t.co/Kt9vmw0Fap,9,10,Ozzy,,https://pbs.twimg.com/media/CXBBurSWMAELewi.jpg,1,pug,0.999365,True,French_bulldog,0.000543615,True,Boston_bull,2.8152800000000003e-05,True,2446,811,20:00:22,2015-12-24
680070545539371008,TweetDeck,Say hello to Emmie. She's trapped in an ornament. Tragic af. Looks pretty content tho. Maybe it's meant to be. 9/10 https://t.co/Fh7geodBCU,9,10,Emmie,,https://pbs.twimg.com/media/CW-dU34WQAANBGy.jpg,1,earthstar,0.127701,False,Shih-Tzu,0.1218109999999999,True,bubble,0.11782,False,2327,761,17:00:27,2015-12-24
679877062409191424,iPhone,Meet Penelope. She's a bacon frise. Total babe (lol get it like the movie). Doesn't bark tho. 5/10 very average dog https://t.co/SDcQYg0HSZ,5,10,Penelope,,https://pbs.twimg.com/media/CW9olDsUsAA0XSf.jpg,1,hog,0.809466,False,hay,0.0601778,False,lumbermill,0.0164834,False,1734,568,04:11:37,2015-12-24
679854723806179328,iPhone,This is Bruce. He's a rare pup. Covered in Frosted Flakes. Nifty gold teeth. Overall good dog. 7/10 would pet firmly https://t.co/RtxxACzZ8A,7,10,Bruce,,https://pbs.twimg.com/media/CW9UQ7oWkAAErmU.jpg,1,llama,0.887963,False,ram,0.0950207,False,chow,0.00230739,True,2549,1080,02:42:51,2015-12-24
679844490799091713,iPhone,This is Willie. He's floating away and needs your assistance. Please someone help Willie. 10/10 https://t.co/MJqygWqt8X,10,10,Willie,,https://pbs.twimg.com/media/CW9K9VeVAAE0j-x.jpg,1,Airedale,0.903832,True,Border_terrier,0.0347125999999999,True,toy_poodle,0.021378,True,2134,677,02:02:12,2015-12-24
679777920601223168,iPhone,This is Rinna. She's melting. 10/10 get inside pupper https://t.co/PA0czwucsb,10,10,Rinna,pupper,https://pbs.twimg.com/media/CW8OYajUMAAPRoF.jpg,1,bloodhound,0.5288189999999999,True,bull_mastiff,0.4201189999999999,True,French_bulldog,0.00948059,True,2791,973,21:37:40,2015-12-23
679729593985699840,iPhone,This is Hunter. He was playing with his ball minding his own business. Has no idea what happened to the carpet. 8/10 https://t.co/DbUTDI3u1R,8,10,Hunter,,https://pbs.twimg.com/media/CW7iddWUsAElUC0.jpg,1,wallaby,0.164215,False,West_Highland_white_terrier,0.0935148,True,ashcan,0.0672783,False,1952,732,18:25:38,2015-12-23
679722016581222400,iPhone,This is Mike. He is a Jordanian Frito Pilates. Frowning because he can't see directly in front of him. 8/10 https://t.co/NL5QJwdEpF,8,10,Mike,,https://pbs.twimg.com/media/CW7bkW6WQAAksgB.jpg,1,boxer,0.459604,True,Boston_bull,0.197913,True,French_bulldog,0.0870225,True,1496,421,17:55:32,2015-12-23
679511351870550016,iPhone,Say hello to William. He makes fun of others because he's terrified of his own deep-seated insecurities. 7/10 https://t.co/bwuV6FlRxr,7,10,William,,https://pbs.twimg.com/media/CW4b-GUWYAAa8QO.jpg,1,Chihuahua,0.761972,True,black-footed_ferret,0.150605,False,squirrel_monkey,0.0281479,False,2992,1116,03:58:25,2015-12-23
679503373272485890,iPhone,This is Dwight. He's a pointy pupper. Very docile. Attracts marshmallows. Hurts to pet but definitely worth it 8/10 https://t.co/jjW7zTxY9Z,8,10,Dwight,pupper,https://pbs.twimg.com/media/CW4UtmYWsAAEjqA.jpg,1,porcupine,0.999846,False,meerkat,7.191479999999999e-05,False,echidna,4.44729e-05,False,2835,1311,03:26:43,2015-12-23
679475951516934144,iPhone,This is Evy. She doesn't want to be a Koala. 9/10 https://t.co/VITeF0Kl9L,9,10,Evy,,https://pbs.twimg.com/media/CW37xZbUoAAUXe5.jpg,1,Maltese_dog,0.145742,True,toy_poodle,0.139407,True,West_Highland_white_terrier,0.108821,True,1872,566,01:37:45,2015-12-23
679462823135686656,iPhone,Meet Hurley. He's the curly one. He hugs every other dog he sees during his walk. 11/10 for spreading the love https://t.co/M6vqkt2GKV,11,10,Hurley,,https://pbs.twimg.com/media/CW3v1KxW8AAIOuy.jpg,1,toy_poodle,0.62178,True,miniature_poodle,0.197819,True,soft-coated_wheaten_terrier,0.046745,True,28752,16733,00:45:35,2015-12-23
679158373988876288,iPhone,This is Rubio. He has too much skin. 11/10 https://t.co/NLOHmlENag,11,10,Rubio,,https://pbs.twimg.com/media/CWza7kpWcAAdYLc.jpg,1,pug,0.272205,True,bull_mastiff,0.25153,True,bath_towel,0.116806,False,18983,7112,04:35:49,2015-12-22
679132435750195208,iPhone,This is Louis. He's a river dancer. His friends think it's badass. All are very supportive. 10/10 for Louis https://t.co/qoIvjKMY58,10,10,Louis,,https://pbs.twimg.com/media/CWzDWOkXAAAP0k7.jpg,1,Scottish_deerhound,0.1946099999999999,True,Irish_wolfhound,0.162855,True,giant_schnauzer,0.1598369999999999,True,2623,1013,02:52:45,2015-12-22
679062614270468097,iPhone,This is Chompsky. He lives up to his name. 11/10 https://t.co/Xl37lQEWd0,11,10,Chompsky,,https://pbs.twimg.com/media/CWyD2HGUYAQ1Xa7.jpg,2,cash_machine,0.802333,False,schipperke,0.0455186,True,German_shepherd,0.0233535,True,15138,7077,22:15:18,2015-12-21
678969228704284672,iPhone,Meet Lola. She's a Metamorphic Chartreuse. Plays with her food. Insubordinate and churlish. Exquisite hardwood 11/10 https://t.co/etpBNXwN7f,11,10,Lola,,https://pbs.twimg.com/media/CWwu6OLUkAEo3gq.jpg,1,Labrador_retriever,0.680251,True,Chesapeake_Bay_retriever,0.201697,True,golden_retriever,0.0196759,True,1464,404,16:04:13,2015-12-21
678798276842360832,iPhone,This is Linda. She fucking hates trees. 7/10 https://t.co/blaY85FIxR,7,10,Linda,,https://pbs.twimg.com/media/CWuTbAKUsAAvZHh.jpg,1,Airedale,0.583122,True,silky_terrier,0.129567,True,Lakeland_terrier,0.0947266,True,3098,1009,04:44:55,2015-12-21
678774928607469569,iPhone,This is Tug. He's not required to wear the cone he just wants his voice to project more clearly. 11/10 https://t.co/Sp739Ou2qx,11,10,Tug,,https://pbs.twimg.com/media/CWt-MNIWEAAUC9S.jpg,1,Pembroke,0.194681,True,toy_poodle,0.121821,True,Pomeranian,0.096843,True,2509,802,03:12:08,2015-12-21
678767140346941444,iPhone,This is Mia. She makes awful decisions. 8/10 https://t.co/G6TQVgTcZz,8,10,Mia,,https://pbs.twimg.com/media/CWt3G6EVEAIGEPr.jpg,1,harp,0.8211200000000001,False,window_screen,0.0251208,False,mosquito_net,0.0167155999999999,False,3148,1203,02:41:11,2015-12-21
678764513869611008,iPhone,"Meet Wilson. He got caught humping the futon. He's like ""dude, help me out here"" 10/10 I'd help Wilson out https://t.co/m6XoclB0qv",10,10,Wilson,,https://pbs.twimg.com/media/CWt0ubZWcAAkFER.jpg,1,Irish_terrier,0.696646,True,Australian_terrier,0.0749616,True,Irish_setter,0.0639011999999999,True,1453,411,02:30:45,2015-12-21
678755239630127104,iPhone,This is Dash. He didn't think the water would be that cold. Damn it Dash it's December. Think a little. 10/10 https://t.co/NqcOwG8pxW,10,10,Dash,,https://pbs.twimg.com/media/CWtsSQAUkAAnWws.jpg,1,malamute,0.606654,True,Border_collie,0.193831,True,collie,0.0483781,True,6361,2881,01:53:54,2015-12-21
678740035362037760,iPhone,Meet Tango. He's a large dog. Doesn't care much for personal space. Owner isn't very accepting. Tongue slip. 6/10 https://t.co/p2T5kGebxe,6,10,Tango,,https://pbs.twimg.com/media/CWtede2WIAAF_AJ.jpg,1,seat_belt,0.7871640000000001,False,sunglasses,0.0457386999999999,False,beagle,0.0225251,True,3317,1465,00:53:29,2015-12-21
678643457146150913,iPhone,Meet Grizz. He just arrived. Couldn't wait until Christmas. Worried bc he saw the swastikas on the carpet. 10/10 https://t.co/QBGwYrT7rv,10,10,Grizz,,https://pbs.twimg.com/media/CWsGnyMVEAAM1Y1.jpg,1,Labrador_retriever,0.338757,True,flat-coated_retriever,0.3044699999999999,True,chest,0.0933923,False,1825,352,18:29:43,2015-12-20
678424312106393600,iPhone,This is Crystal. She's a shitty fireman. No sense of urgency. People could be dying Crystal. 2/10 just irresponsible https://t.co/rtMtjSl9pz,2,10,Crystal,,https://pbs.twimg.com/media/CWo_T8gW4AAgJNo.jpg,1,Maltese_dog,0.759945,True,toy_poodle,0.101194,True,Shih-Tzu,0.0560374,True,4881,2223,03:58:55,2015-12-20
678410210315247616,iPhone,Say hello to Jerome. He can shoot french fries out of his mouth at insane speeds. Deadly af. 10/10 https://t.co/dIy88HwrX8,10,10,Jerome,,https://pbs.twimg.com/media/CWoyfMiWUAAmGdd.jpg,1,schipperke,0.145877,True,Labrador_retriever,0.0983538,True,kelpie,0.0973933999999999,True,3744,1583,03:02:53,2015-12-20
678389028614488064,iPhone,"This is Bella. She just learned that her final grade in chem was a 92.49 
poor pupper 11/10 https://t.co/auOoKuoveM",11,10,Bella,pupper,https://pbs.twimg.com/media/CWofOHUWUAACGVa.jpg,1,miniature_pinscher,0.516284,True,kelpie,0.227402,True,vizsla,0.103246,True,1673,371,01:38:42,2015-12-20
678380236862578688,iPhone,This is Crumpet. He underestimated the snow. Quickly retreating. 10/10 https://t.co/a0Zx5LDFZa,10,10,Crumpet,,https://pbs.twimg.com/media/CWoXOfSUAAA4u8g.jpg,1,dogsled,0.08854,False,snowmobile,0.0572909999999999,False,Samoyed,0.0476014,True,2182,804,01:03:46,2015-12-20
678334497360859136,iPhone,This is Rosie. She has a snazzy bow tie and a fin for a tail. Probably super fast underwater. Cool socks 10/10 https://t.co/GO76MdGBs0,10,10,Rosie,,https://pbs.twimg.com/media/CWntoDVWcAEl3NB.jpg,1,Norfolk_terrier,0.378643,True,golden_retriever,0.0955939,True,kelpie,0.0853092,True,1157,222,22:02:01,2015-12-19
678255464182861824,iPhone,This is Jessifer. She is a Bismoth Teriyaki. Flowers being attacked by hurricanes on bandana (rad). 9/10 stellar pup https://t.co/nZhmRwZzWv,9,10,Jessifer,,https://pbs.twimg.com/media/CWmlvxJU4AEAqaN.jpg,1,Chihuahua,0.613819,True,Yorkshire_terrier,0.127931,True,Pomeranian,0.0621243,True,1417,321,16:47:58,2015-12-19
678021115718029313,iPhone,This is Reese. He likes holding hands. 12/10 https://t.co/cbLroGCbmh,12,10,Reese,,https://pbs.twimg.com/media/CWjQm5gXAAA9GkD.jpg,1,miniature_pinscher,0.822048,True,Doberman,0.0960845,True,Rottweiler,0.0327093,True,12063,5514,01:16:45,2015-12-19
677700003327029250,iPhone,This is Ralph. He's an interpretive dancer. 10/10 https://t.co/zoDdPyPFsa,10,10,Ralph,,https://pbs.twimg.com/media/CWesj06W4AAIKl8.jpg,1,Siberian_husky,0.120849,True,junco,0.0792056,False,malamute,0.0630875,True,3037,1262,04:00:46,2015-12-18
677698403548192770,iPhone,This is Sadie. She got her holidays confused. 9/10 damn it Sadie https://t.co/fm7HxOsuPK,9,10,Sadie,,https://pbs.twimg.com/media/CWerGmOXAAAm6NY.jpg,1,Shih-Tzu,0.916645,True,Lhasa,0.0578834,True,Pekinese,0.0201258,True,1086,281,03:54:25,2015-12-18
677573743309385728,iPhone,This is Sandy. He's sexually confused. Thinks he's a pigeon. Also an All-American cheese catcher. 10/10 so petable https://t.co/Htu8plSqEu,10,10,Sandy,,https://pbs.twimg.com/media/CWc5uVPXIAErLYr.jpg,2,patio,0.5350699999999999,False,folding_chair,0.0804192,False,parallel_bars,0.0347964999999999,False,1900,586,19:39:03,2015-12-17
677530072887205888,iPhone,Say hello to Axel. He's a Black Chevy Pinot on wheels. 0 to 60 in 5.7 seconds (if downhill). 9/10 I call shotgun https://t.co/DKe9DBnnHE,9,10,Axel,,https://pbs.twimg.com/media/CWcSAI-WUAAOB9W.jpg,1,Staffordshire_bullterrier,0.6892590000000001,True,Norwegian_elkhound,0.026121,True,American_Staffordshire_terrier,0.0230747,True,941,196,16:45:31,2015-12-17
677331501395156992,iPhone,Meet Humphrey. He's a Northern Polyp Viagra. One ear works. Face stuck like that. Always surprised. 9/10 petable af https://t.co/FS7eJQM2F4,9,10,Humphrey,,https://pbs.twimg.com/media/CWZdaGxXAAAjGjb.jpg,1,beagle,0.3134639999999999,True,boxer,0.218503,True,French_bulldog,0.1064619999999999,True,963,202,03:36:28,2015-12-17
677328882937298944,iPhone,This is Derek. All the dogs adore Derek. He's a great guy. 10/10 really solid pup https://t.co/KgcsGNb61s,10,10,Derek,,https://pbs.twimg.com/media/CWZbBlAUsAAjRg5.jpg,1,water_buffalo,0.42425,False,kelpie,0.0290541,True,Staffordshire_bullterrier,0.0284697,True,3256,1314,03:26:04,2015-12-17
677314812125323265,iPhone,"Meet Tassy &amp; Bee. Tassy is pretty chill, but Bee is convinced the Ruffles are haunted. 10/10 &amp; 11/10 respectively https://t.co/fgORpmTN9C",10,10,Tassy,,https://pbs.twimg.com/media/CWZOOIUW4AAQrX_.jpg,2,Blenheim_spaniel,0.924127,True,Japanese_spaniel,0.0547900999999999,True,Chihuahua,0.00820404,True,1462,459,02:30:09,2015-12-17
677301033169788928,iPhone,This is Juckson. He's totally on his way to a nascar race. 5/10 for Juckson https://t.co/IoLRvF0Kak,5,10,Juckson,,https://pbs.twimg.com/media/CWZBsjPWsAAZFFl.jpg,1,Japanese_spaniel,0.6611779999999999,True,Pekinese,0.150119,True,Chihuahua,0.11972,True,1086,350,01:35:24,2015-12-17
677228873407442944,iPhone,Say hello to Chuq. He just wants to fit in. 11/10 https://t.co/hGkMCjZzn4,11,10,Chuq,,https://pbs.twimg.com/media/CWYAEINW4AIuw8P.jpg,1,common_iguana,0.566338,False,tennis_ball,0.154646,False,green_lizard,0.0449758,False,3145,1428,20:48:40,2015-12-16
676975532580409345,iPhone,This is Cooper. He doesn't know how cheese works. Likes the way it feels on his face. Cheeky tongue slip. 11/10 https://t.co/j1zczS0lI5,11,10,Cooper,,https://pbs.twimg.com/media/CWUZpydWcAAeipD.jpg,1,malamute,0.363257,True,Siberian_husky,0.245862,True,Eskimo_dog,0.125547,True,2467,930,04:01:59,2015-12-16
676949632774234114,iPhone,This is Tyrus. He's a Speckled Centennial Ticonderoga. Terrified of floating red ball. Nifty bandana. 8/10 v petable https://t.co/HqM3YhCaaa,8,10,Tyrus,,https://pbs.twimg.com/media/CWUCGMtWEAAjXnS.jpg,1,Welsh_springer_spaniel,0.206479,True,Saint_Bernard,0.139339,True,boxer,0.114606,True,1155,344,02:19:04,2015-12-16
676948236477857792,iPhone,This is Karl. Karl thinks he's slick. 6/10 sneaky pup https://t.co/Lo4ALwjVh4,6,10,Karl,,https://pbs.twimg.com/media/CWUA1GFW4AAowiq.jpg,1,guenon,0.611603,False,macaque,0.135176,False,squirrel_monkey,0.0832473,False,1912,760,02:13:31,2015-12-16
676864501615042560,iPhone,Meet Ash. He's just a head now. Lost his body during the Third Crusade. Still in good spirits. 10/10 would pet well https://t.co/NJj2uP0atK,10,10,Ash,,https://pbs.twimg.com/media/CWS0q8iU8AE2Srr.jpg,1,Chesapeake_Bay_retriever,0.371146,True,water_buffalo,0.0995963,False,Weimaraner,0.0489679,True,1839,613,20:40:47,2015-12-15
676811746707918848,iPhone,Say hello to Penny &amp; Gizmo. They are practicing their caroling. The ambition in the room is tangible. 9/10 for both https://t.co/aqBHjjh5VD,9,10,Penny,,https://pbs.twimg.com/media/CWSEsO9WwAAX-fZ.jpg,1,Chihuahua,0.440916,True,Pomeranian,0.345806,True,cocker_spaniel,0.0603312,True,1278,369,17:11:09,2015-12-15
676603393314578432,iPhone,This is Godzilla pupper. He had a ruff childhood &amp; now deflects that pain outward by terrorizing cities. Tragic 9/10 https://t.co/g1tLGkyaxr,9,10,Godzilla,pupper,https://pbs.twimg.com/media/CWPHMqKVAAAE78E.jpg,1,whippet,0.8770209999999999,True,Great_Dane,0.0341819,True,boxer,0.028404,True,1019,331,03:23:14,2015-12-15
676588346097852417,iPhone,This is Bubbles. He kinda resembles a fish. Always makes eye contact with u no matter what. Sneaky tongue slip. 5/10 https://t.co/Nrhvc5tLFT,5,10,Bubbles,,https://pbs.twimg.com/media/CWO5gmCUYAAX4WA.jpg,1,Boston_bull,0.976577,True,French_bulldog,0.0143237,True,Chihuahua,0.00230192,True,2035,679,02:23:26,2015-12-15
676582956622721024,iPhone,"Meet Vinnie. He's having fun while being safe. Well not a lot of fun, but definitely safe, and that's important 8/10 https://t.co/vZYtynZZlH",8,10,Vinnie,,https://pbs.twimg.com/media/CWO0m8tUwAAB901.jpg,1,seat_belt,0.790028,False,Boston_bull,0.1963069999999999,True,French_bulldog,0.0124289,True,1048,247,02:02:01,2015-12-15
676496375194980353,iPhone,Say hello to Griffin. He's upset because his costume for Halloween didn't arrive until today. 9/10 cheer up pup https://t.co/eoBCjSFajX,9,10,Griffin,,https://pbs.twimg.com/media/CWNl3S9WcAARN34.jpg,1,pug,0.985387,True,Norwegian_elkhound,0.0044169,True,French_bulldog,0.00389287,True,1336,458,20:17:59,2015-12-14
676430933382295552,iPhone,"Meet Duke. He's an Urban Parmesan. They know he's scared of the green rubber dog. ""Why u do dis?"" thinks Duke. 10/10 https://t.co/3bim9U5Idr",10,10,Duke,,https://pbs.twimg.com/media/CWMqV7WUYAEEClG.jpg,1,golden_retriever,0.583875,True,cocker_spaniel,0.203671,True,Labrador_retriever,0.0361217,True,1232,299,15:57:56,2015-12-14
676237365392908289,iPhone,Say hello to Winston. He has no respect for the system. Much rebellion. I think that's a palm tree... nice. 8/10 https://t.co/dOLQddhXLZ,8,10,Winston,,https://pbs.twimg.com/media/CWJ6Sc-WwAAlpI6.jpg,1,French_bulldog,0.961996,True,Chihuahua,0.021793,True,Boston_bull,0.00691629,True,1058,241,03:08:46,2015-12-14
676219687039057920,iPhone,This is Kenneth. He's stuck in a bubble. 10/10 hang in there Kenneth https://t.co/uQt37xlYMJ,10,10,Kenneth,,https://pbs.twimg.com/media/CWJqN9iWwAAg86R.jpg,1,bubble,0.997556,False,leafhopper,0.000158961,False,whippet,0.000132464,True,69086,27234,01:58:31,2015-12-14
676215927814406144,iPhone,This is Herm. He just wants to be like the other dogs. Sneaky tongue slip. Super fuzzy. 9/10 would cuddle firmly https://t.co/tg8h9lzCHv,9,10,Herm,,https://pbs.twimg.com/media/CWJmzNsWUAE706Z.jpg,1,hamster,0.999484,False,guinea_pig,0.000158217,False,broccoli,6.091100000000001e-05,False,1526,508,01:43:35,2015-12-14
676146341966438401,iPhone,This is Bert. He likes flowers. 10/10 https://t.co/lmQRrNxaQu,10,10,Bert,,https://pbs.twimg.com/media/CWIngp5WEAAJOy3.jpg,1,Irish_water_spaniel,0.388332,True,standard_poodle,0.284121,True,greenhouse,0.0348681,False,1716,573,21:07:04,2015-12-13
676101918813499392,iPhone,Meet Striker. He's ready for Christmas. 11/10 https://t.co/B3xxSLjQSH,11,10,Striker,,https://pbs.twimg.com/media/CWH_FTgWIAAwOUy.jpg,1,Shih-Tzu,0.225848,True,Norfolk_terrier,0.186873,True,Irish_terrier,0.1069869999999999,True,2530,1031,18:10:33,2015-12-13
675891555769696257,iPhone,This is Donny. He's summoning the demon monster Babadook. 6/10 Donny please no that won't be a good time for anyone https://t.co/kiW6Knb7Gp,6,10,Donny,,https://pbs.twimg.com/media/CWE_x33UwAEE3no.jpg,1,Italian_greyhound,0.305637,True,whippet,0.232057,True,Great_Dane,0.117806,True,1872,748,04:14:39,2015-12-13
675845657354215424,iPhone,"This is Pepper. She's not fully comfortable riding her imaginary bike yet. 10/10 don't worry pupper, it gets easier https://t.co/40dj4eTsXG",10,10,Pepper,pupper,https://pbs.twimg.com/media/CWEWClfW4AAnqhG.jpg,1,pug,0.8839520000000001,True,Boston_bull,0.0110568,True,French_bulldog,0.00983981,True,1994,763,01:12:15,2015-12-13
675798442703122432,iPhone,This is Bernie. He just touched a boob for the first time. 10/10 https://t.co/whQKMygnK6,10,10,Bernie,,https://pbs.twimg.com/media/CWDrGH4UYAARoq_.jpg,1,beagle,0.681218,True,basset,0.125121,True,boxer,0.0803982,True,9107,2998,22:04:39,2015-12-12
675781562965868544,iPhone,Say hello to Buddah. He was Waldo for Halloween. 11/10 https://t.co/DVAqAnb624,11,10,Buddah,,https://pbs.twimg.com/media/CWDbv2yU4AARfeH.jpg,1,Maltese_dog,0.921968,True,West_Highland_white_terrier,0.0178107,True,toy_poodle,0.0135554,True,1422,413,20:57:34,2015-12-12
675710890956750848,iPhone,This is Lenny. He was just told that he couldn't explore the fish tank. 12/10 smh all that work for nothing https://t.co/JWi6YrpiO1,12,10,Lenny,,https://pbs.twimg.com/media/CWCbd8ZWoAAtqoH.jpg,2,standard_schnauzer,0.441427,True,miniature_schnauzer,0.248885,True,Sealyham_terrier,0.164967,True,1640,706,16:16:45,2015-12-12
675531475945709568,iPhone,This is Ellie AKA Queen Slayer of the Orbs. Very self-motivated. Great yard. Rad foliage. 10/10 would pet diligently https://t.co/c9jmg3Xtzn,10,10,Ellie,,https://pbs.twimg.com/media/CV_4ShmUYAA3wNu.jpg,1,Pembroke,0.918441,True,Cardigan,0.0273395,True,Siberian_husky,0.020221,True,1042,322,04:23:49,2015-12-12
675522403582218240,iPhone,Meet Sammy. He's a Motorola Firefox. Hat under hoodie (must be a half-decent up and coming white rapper) 10/10 https://t.co/rO2zxf0OQ0,10,10,Sammy,,https://pbs.twimg.com/media/CV_wCh8W4AEWWZ9.jpg,1,cocker_spaniel,0.299708,True,golden_retriever,0.263665,True,Irish_setter,0.0803233,True,912,245,03:47:46,2015-12-12
675497103322386432,iPhone,Meet Reggie. He's going for the world record. Must concentrate. Focus up pup. 11/10 we all believe in you Reggie https://t.co/h3AWz4AzuC,11,10,Reggie,,https://pbs.twimg.com/media/CV_ZAhcUkAUeKtZ.jpg,1,vizsla,0.5195890000000001,True,miniature_pinscher,0.0647712,True,Rhodesian_ridgeback,0.0614913,True,2749,1106,02:07:14,2015-12-12
675362609739206656,iPhone,This is Daisy. She loves that shoe. Still no seat belt. Super churlish. 12/10 the dogs are killing it today https://t.co/cZlkvgRPdn,12,10,Daisy,,https://pbs.twimg.com/media/CV9etctWUAAl5Hp.jpg,1,Labrador_retriever,0.479008,True,ice_bear,0.2182889999999999,False,kuvasz,0.1399109999999999,True,917,189,17:12:48,2015-12-11
675166823650848770,iPhone,This is Arnold. He broke his leg saving a handicapped child from a forest fire. True hero. 10/10 inspirational dog https://t.co/bijCeHeX4C,10,10,Arnold,,https://pbs.twimg.com/media/CV6spB7XAAIpMyP.jpg,1,llama,0.284394,False,standard_poodle,0.132569,True,teddy,0.127975,False,3097,1355,04:14:49,2015-12-11
675146535592706048,iPhone,This is Coops. He's yelling at the carpet. Not very productive Coops. 7/10 https://t.co/Uz52oYnHzF,7,10,Coops,,https://pbs.twimg.com/media/CV6aMToXIAA7kH4.jpg,1,dingo,0.2884469999999999,False,Cardigan,0.229944,True,Pembroke,0.190407,True,1038,248,02:54:12,2015-12-11
675135153782571009,iPhone,This is Steven. He got locked outside. Damn it Steven. 5/10 nice grill tho https://t.co/zf7Sxxjfp3,5,10,Steven,,https://pbs.twimg.com/media/CV6P1lnWIAAUQHk.jpg,1,stove,0.587507,False,rotisserie,0.0517131,False,microwave,0.0207253,False,1138,403,02:08:58,2015-12-11
675113801096802304,iPhone,Meet Zuzu. He just graduated college. Astute pupper. Needs 2 leashes to contain him. Wasn't ready for the pic. 10/10 https://t.co/2H5SKmk0k7,10,10,Zuzu,pupper,https://pbs.twimg.com/media/CV58a4nXAAApywo.jpg,1,bow,0.16802,False,quill,0.1088069999999999,False,joystick,0.0433118,False,1694,677,00:44:07,2015-12-11
675111688094527488,iPhone,Say hello to Oliver. He thought what was inside the pillow should be outside the pillow. Blurry since birth. 8/10 https://t.co/lFU9W31Fg9,8,10,Oliver,,https://pbs.twimg.com/media/CV56f54WsAEv4kJ.jpg,1,Labrador_retriever,0.631501,True,Brittany_spaniel,0.101927,True,Chesapeake_Bay_retriever,0.0626498,True,846,209,00:35:44,2015-12-11
675015141583413248,iPhone,Meet Moe. He's a golden Fetty Woof. Doesn't respect the authorities. Might own a motorhome? 10/10 revolutionary pup https://t.co/JAncIdNp8G,10,10,Moe,,https://pbs.twimg.com/media/CV4iqh5WcAEV1E6.jpg,1,street_sign,0.290091,False,golden_retriever,0.258372,True,sandbar,0.132173,False,2356,1016,18:12:05,2015-12-10
675006312288268288,iPhone,Say hello to Mollie. This pic was taken after she bet all her toys on Ronda Rousey. 10/10 hang in there pupper https://t.co/QMmAqA9VqO,10,10,Mollie,pupper,https://pbs.twimg.com/media/CV4aqCwWsAIi3OP.jpg,1,boxer,0.654697,True,space_heater,0.0433888,False,beagle,0.0428476,True,853,195,17:37:00,2015-12-10
675003128568291329,iPhone,Meet Laela. She's adorable. Magnificent eyes. But I don't see a seat belt. Insubordinate.. and churlish. Still 12/10 https://t.co/pCGDgLkLo6,12,10,Laela,,https://pbs.twimg.com/media/CV4XwYiWoAAHQIF.jpg,1,Pembroke,0.655279,True,Pomeranian,0.104164,True,Cardigan,0.0528177,True,1356,397,17:24:21,2015-12-10
