tweet_id,source,text,rating_numerator,rating_denominator,name,stage,jpg_url,img_num,p1,p1_conf,p1_dog,p2,p2_conf,p2_dog,p3,p3_conf,p3_dog,favorite_count,retweet_count,post_time,post_date
813081950185472002,iPhone,This is Baron. He's officially festive as h*ck. Thinks it's just a fancy scarf. 11/10 would pat head approvingly https://t.co/PjulYEXTvg,11,10,Baron,,https://pbs.twimg.com/media/C0ilsa1XUAEHK_k.jpg,2,Doberman,0.909951,True,kelpie,0.0426494,True,miniature_pinscher,0.0230041,True,9182,2555,18:00:17,2016-12-25
813066809284972545,iPhone,This is Tyr. He is disgusted by holiday traffic. Just trying to get to Christmas brunch on time. 12/10 hurry up pup https://t.co/syuTXARdtN,12,10,Tyr,,https://pbs.twimg.com/media/C0iX8OOVEAEIpMC.jpg,1,toy_terrier,0.7764,True,Pembroke,0.115034,True,basenji,0.048873,True,7363,1800,17:00:08,2016-12-25
813051746834595840,iPhone,This is Bauer. He had nothing to do with the cookies that disappeared. 13/10 very good boy https://t.co/AIMF8ouzvl,13,10,Bauer,,https://pbs.twimg.com/media/C0iKPZIXUAAbDYV.jpg,1,golden_retriever,0.914804,True,Labrador_retriever,0.08355,True,kuvasz,0.000453224,True,19425,6720,16:00:16,2016-12-25
812781120811126785,iPhone,This is Swagger. He's the Cleveland Browns ambassador. Hype as h*ck after that first win today. 10/10 https://t.co/lXFM1l22bG,10,10,Swagger,,https://pbs.twimg.com/media/C0eUHfWUAAANEYr.jpg,1,bull_mastiff,0.989316,True,boxer,0.00704296,True,French_bulldog,0.00173961,True,6977,1764,22:04:54,2016-12-24
812709060537683968,iPhone,This is Brandi and Harley. They are practicing their caroling for later. Both 12/10 festive af https://t.co/AbBDuGZUpp,12,10,Brandi,,https://pbs.twimg.com/media/C0dSk98WEAALyya.jpg,1,Irish_setter,0.326873,True,golden_retriever,0.18261,True,Leonberg,0.156912,True,6107,1337,17:18:34,2016-12-24
812466873996607488,iPhone,This is Mary. She's desperately trying to recreate her Coachella experience.   12/10 downright h*ckin adorable https://t.co/BAJrfPvtux,12,10,Mary,,https://pbs.twimg.com/media/C0Z2T_GWgAAxbL9.jpg,1,bath_towel,0.0998035,False,pillow,0.0923181,False,Great_Dane,0.0782055,True,7362,1772,01:16:12,2016-12-24
812372279581671427,iPhone,This is Moe. He's a fetty woof. Got a cardboard cutout of himself for Christmas. 13/10 inspirational af https://t.co/gCnAeL2mvT,13,10,Moe,,https://pbs.twimg.com/media/C0YgO3DW8AAz98O.jpg,2,golden_retriever,0.7848729999999999,True,cocker_spaniel,0.0877881,True,Labrador_retriever,0.0832747,True,12597,3365,19:00:19,2016-12-23
811985624773361665,iPhone,Say hello to Ted. He accidentally opened the front facing camera. 11/10 h*ckin unpupared https://t.co/sIB5C6FDop,11,10,Ted,,https://pbs.twimg.com/media/C0TAnZIUAAAADKs.jpg,1,Staffordshire_bullterrier,0.6105729999999999,True,French_bulldog,0.159935,True,doormat,0.0586721,False,6730,1293,17:23:53,2016-12-22
811744202451197953,iPhone,This is Halo. She likes watermelon. 13/10 https://t.co/TZkiQZqwA6,13,10,Halo,,https://pbs.twimg.com/media/C0PlCQjXAAA9TIh.jpg,1,Pekinese,0.386082,True,Labrador_retriever,0.202862,True,golden_retriever,0.170487,True,6986,1448,01:24:33,2016-12-22
811627233043480576,iPhone,This is Augie. He's a savage. Doesn't give a h*ck about your garden. Still 10/10 would forgive then pet https://t.co/IU8S0n4oxn,10,10,Augie,,https://pbs.twimg.com/media/C0N6opSXAAAkCtN.jpg,1,beagle,0.39628,True,Pembroke,0.0495619,True,wire-haired_fox_terrier,0.0463491999999999,True,11768,2796,17:39:46,2016-12-21
811386762094317568,iPhone,This is Craig. That's actually a normal sized fence he's stuck on. H*ckin massive pupper. 11/10 someone help him https://t.co/aAUXzoxaBy,11,10,Craig,pupper,https://pbs.twimg.com/media/C0Kf9PtWQAEW4sE.jpg,1,Pembroke,0.804177,True,Cardigan,0.18989,True,beagle,0.00196475,True,19316,5869,01:44:13,2016-12-21
810896069567610880,iPhone,"This is Hunter. He just found out he needs braces. Requesting an orthodogtist stat. 11/10 you're fine Hunter, everything's fine https://t.co/zW1o0W4AYV",11,10,Hunter,,https://pbs.twimg.com/media/C0DhpcrUAAAnx88.jpg,1,flat-coated_retriever,0.8208040000000001,True,Labrador_retriever,0.0823182,True,curly-coated_retriever,0.0674605,True,8304,1610,17:14:23,2016-12-19
810657578271330305,iPhone,This is Pavlov. His floatation device has failed him. He's quite pupset about it. 11/10 would rescue https://t.co/MXd0AGDsRJ,11,10,Pavlov,,https://pbs.twimg.com/media/C0AIwgVXAAAc1Ig.jpg,1,malamute,0.753521,True,Siberian_husky,0.166151,True,Eskimo_dog,0.0698108,True,10135,2421,01:26:42,2016-12-19
810284430598270976,iPhone,This is Phil. He's a father. A very good father too. 13/10 everybody loves Phil https://t.co/9p6ECXJMMu,13,10,Phil,,https://pbs.twimg.com/media/Cz61ZD4W8AAcJEU.jpg,1,malamute,0.620768,True,Eskimo_dog,0.158395,True,Tibetan_mastiff,0.0289617,True,32452,10327,00:43:57,2016-12-18
810254108431155201,iPhone,"This is Gus. He likes to be close to you, which is good because you want to be close to Gus. 12/10 would boop then pet https://t.co/DrsrQkEfnb",12,10,Gus,,https://pbs.twimg.com/media/Cz6Z0DgWIAAfdvp.jpg,1,Staffordshire_bullterrier,0.292556,True,American_Staffordshire_terrier,0.261233,True,Border_terrier,0.0623754,True,13543,3095,22:43:27,2016-12-17
809220051211603969,iPhone,This is Kyro. He's a Stratocumulus Flop. Tongue ejects at random. Serious h*ckin condition. Still 12/10 would pet passionately https://t.co/wHu15q2Q6p,12,10,Kyro,,https://pbs.twimg.com/media/CzrtWDbWEAAmIhy.jpg,1,Pomeranian,0.8195110000000001,True,Samoyed,0.141241,True,Pembroke,0.0134552,True,18350,5147,02:14:29,2016-12-15
809084759137812480,iPhone,"This is Wallace. You said you brushed your teeth but he checked your toothbrush and it was bone dry. 11/10 not pupset, just disappointed https://t.co/nadm8yWZ4h",11,10,Wallace,,https://pbs.twimg.com/media/CzpyM41UoAE1b2w.jpg,1,vizsla,0.911412,True,bloodhound,0.0171339,True,Labrador_retriever,0.011761,True,12195,3225,17:16:53,2016-12-14
808838249661788160,iPhone,This is Ito. He'll be your uber driver tonight. Currently adjusting the mirrors. 13/10 incredibly h*ckin responsible https://t.co/Zrrcw29o13,13,10,Ito,,https://pbs.twimg.com/media/CzmSFlKUAAAQOjP.jpg,1,Rottweiler,0.36953,True,miniature_pinscher,0.194867,True,kelpie,0.160104,True,9360,2810,00:57:20,2016-12-14
808501579447930884,iPhone,This is Koda. He dug a hole and then sat in it because why not. Unamused by the bath that followed. 12/10 https://t.co/SQhyqrr8px,12,10,Koda,,https://pbs.twimg.com/media/Czhf4XtVQAAIqpd.jpg,2,Airedale,0.454239,True,cocker_spaniel,0.219323,True,Irish_terrier,0.093193,True,10463,2418,02:39:32,2016-12-13
808001312164028416,iPhone,This is Cooper. He likes to stick his tongue out at you and then laugh about it. 12/10 quite the jokester https://t.co/O9iGgvfuzl,12,10,Cooper,,https://pbs.twimg.com/media/CzaY5UdUoAAC91S.jpg,1,Labrador_retriever,0.730959,True,Staffordshire_bullterrier,0.130726,True,American_Staffordshire_terrier,0.0288526,True,11533,3250,17:31:39,2016-12-11
807621403335917568,iPhone,This is Ollie Vue. He was a 3 legged pupper on a mission to overcome everything. This is very hard to write. 14/10 we will miss you Ollie https://t.co/qTRY2qX9y4,14,10,Ollie,pupper,https://pbs.twimg.com/media/CzU_YVGUUAA3Xsd.jpg,3,golden_retriever,0.873233,True,cocker_spaniel,0.0336933,True,chow,0.0204084,True,13489,3328,16:22:02,2016-12-10
807106840509214720,iPhone,This is Stephan. He just wants to help. 13/10 such a good boy https://t.co/DkBYaCAg2d,13,10,Stephan,,https://pbs.twimg.com/ext_tw_video_thumb/807106774843039744/pu/img/8XZg1xW35Xp2J6JW.jpg,1,Chihuahua,0.50537,True,Pomeranian,0.1203579999999999,True,toy_terrier,0.0770081,True,108834,50661,06:17:20,2016-12-09
807010152071229440,iPhone,This is Lennon. He's a Boopershnoop Pupperdoop. Quite rare. Exceptionally pettable. 12/10 would definitely boop that shnoop https://t.co/fhgP6vSfhX,12,10,Lennon,,https://pbs.twimg.com/media/CzMTcZoXUAEKqEt.jpg,1,golden_retriever,0.610807,True,Irish_setter,0.213642,True,Welsh_springer_spaniel,0.0318866,True,12085,3543,23:53:08,2016-12-08
806542213899489280,iPhone,This is Waffles. He's concerned that the dandruff shampoo he just bought is faulty. 11/10 tragic af https://t.co/BCB87qUU0h,11,10,Waffles,,https://pbs.twimg.com/media/CzFp3FNW8AAfvV8.jpg,1,vizsla,0.938617,True,Brittany_spaniel,0.0367389,True,Chesapeake_Bay_retriever,0.00397149,True,9475,2182,16:53:43,2016-12-07
805932879469572096,iPhone,This is Major. He put on a tie for his first real walk. Only a little crooked. Can also drool upwards. H*ckin talented. 12/10 https://t.co/Zcwr8LgoO8,12,10,Major,,https://pbs.twimg.com/media/Cy8_qt0UUAAHuuN.jpg,1,Norwegian_elkhound,0.657967,True,keeshond,0.319136,True,Leonberg,0.00794674,True,7663,1770,00:32:26,2016-12-06
805826884734976000,iPhone,This is Duke. He is not a fan of the pupporazzi. 12/10 https://t.co/SgpBVYIL18,12,10,Duke,,https://pbs.twimg.com/ext_tw_video_thumb/805826823359631360/pu/img/yr_fF0TZCR-B70p2.jpg,1,Siberian_husky,0.248926,True,American_Staffordshire_terrier,0.0983133,True,Eskimo_dog,0.0801885,True,6087,1688,17:31:15,2016-12-05
805520635690676224,iPhone,This is Zeke the Wonder Dog. He never let that poor man keep his frisbees. One of the Spartans all time greatest receivers. 13/10 RIP Zeke https://t.co/zacX7S6GyJ,13,10,Zeke,,https://pbs.twimg.com/media/Cy3IvdZXgAUoEaj.jpg,1,malinois,0.643147,True,German_shepherd,0.186642,True,Border_terrier,0.109345,True,5338,1525,21:14:20,2016-12-04
805487436403003392,iPhone,"Meet Sansa and Gary. They run along the fence together everyday, so the owners installed a window for them. Both 12/10 h*ckin romantic af https://t.co/1JUduNuaWl",12,10,Sansa,,https://pbs.twimg.com/media/Cy2qiTxXcAAtQBH.jpg,3,shield,0.58783,False,barrel,0.0901799,False,sundial,0.0691986,False,8101,2338,19:02:24,2016-12-04
805207613751304193,iPhone,This is Shooter. He's doing quite the snowy zoom. 12/10 https://t.co/lHy4Xbyhd9,12,10,Shooter,,https://pbs.twimg.com/media/CyysDQlVIAAYgrl.jpg,1,Pembroke,0.244705,True,Rhodesian_ridgeback,0.1804609999999999,True,Cardigan,0.0946636999999999,True,7271,1593,00:30:29,2016-12-04
804738756058218496,iPhone,This is Django. He accidentally opened the front facing camera. Did him quite the frighten. 12/10 https://t.co/kQVQoOW9NZ,12,10,Django,,https://pbs.twimg.com/media/CysBn-lWIAAoRx1.jpg,1,Tibetan_mastiff,0.91579,True,German_shepherd,0.0624797,True,Leonberg,0.00829749,True,12599,3538,17:27:25,2016-12-02
804026241225523202,iPhone,This is Bo. He's going to make me cry. 13/10 please get off the bus for him Carly https://t.co/U7FvBZo6Bq,13,10,Bo,,https://pbs.twimg.com/media/Cyh5mQTW8AQpB6K.jpg,1,web_site,0.492709,False,envelope,0.0505658,False,guillotine,0.0152968999999999,False,41107,14766,18:16:08,2016-11-30
803773340896923648,iPhone,This is Diogi. He fell in the pool as soon as he was brought home. Clumsy puppo. 12/10 would pet until dry https://t.co/ZxeRjMKaWt,12,10,Diogi,puppo,https://pbs.twimg.com/media/CyeTku-XcAALkBd.jpg,2,miniature_pinscher,0.817066,True,redbone,0.0597065,True,Irish_terrier,0.0341952,True,9306,2541,01:31:12,2016-11-30
803380650405482500,iPhone,Meet Sonny. He's an in-home movie critic. That is his collection. He's very proud of it. 12/10 https://t.co/yPbCALoy2n,12,10,Sonny,,https://pbs.twimg.com/media/CyYub2kWEAEYdaq.jpg,1,bookcase,0.890601,False,entertainment_center,0.0192874,False,file,0.00948954,False,7180,1741,23:30:47,2016-11-28
803276597545603072,iPhone,This is Winston. His selfie game is legendary. Will steal your girl with a single snap. 11/10 handsome as h*ck https://t.co/jxQhxoPsgL,11,10,Winston,,https://pbs.twimg.com/media/CyXPzXRWgAAvd1j.jpg,1,Pembroke,0.457086,True,chow,0.307801,True,golden_retriever,0.0499881999999999,True,9274,2260,16:37:19,2016-11-28
802952499103731712,iPhone,This is Marley. She's having a ruff day. Pretty pupset. 12/10 would assist https://t.co/yLm7hQ6UXh,12,10,Marley,,https://pbs.twimg.com/media/CySpCSHXcAAN-qC.jpg,1,chow,0.944032,True,golden_retriever,0.0172398,True,Pomeranian,0.0120848,True,8367,1837,19:09:28,2016-11-27
802572683846291456,iPhone,This is Winnie. She's h*ckin ferocious. Dandelion doesn't even see her coming. 12/10 would pet with caution https://t.co/EFfLCP7oQv,12,10,Winnie,,https://pbs.twimg.com/media/CyNPmJgXcAECPuB.jpg,1,golden_retriever,0.610171,True,Labrador_retriever,0.173252,True,cocker_spaniel,0.1632569999999999,True,8286,2315,18:00:13,2016-11-26
802323869084381190,iPhone,This is Severus. He's here to fix your cable. Looks like he succeeded. Even offered to pupgrade your plan. 13/10 h*ckin helpful https://t.co/aX4brLLpWZ,13,10,Severus,,https://pbs.twimg.com/media/CyJtSmDUAAA2F9x.jpg,4,home_theater,0.765069,False,television,0.203578,False,entertainment_center,0.0186435,False,14938,5378,01:31:31,2016-11-26
802239329049477120,iPhone,This is Loki. He'll do your taxes for you. Can also make room in your budget for all the things you bought today. 12/10 what a puppo https://t.co/5oWrHCWg87,12,10,Loki,puppo,https://pbs.twimg.com/media/CyIgaTEVEAA-9zS.jpg,2,Eskimo_dog,0.482498,True,Siberian_husky,0.3357739999999999,True,malamute,0.134589,True,8431,2406,19:55:35,2016-11-25
801958328846974976,iPhone,This is Ronnie. He hopes you're having a great day. Nifty tongue slip. 12/10 would pat head approvingly https://t.co/4fY2bsAm65,12,10,Ronnie,,https://pbs.twimg.com/media/CyEg2AXUsAA1Qpf.jpg,1,Staffordshire_bullterrier,0.327887,True,American_Staffordshire_terrier,0.271916,True,Labrador_retriever,0.247619,True,7178,1564,01:18:59,2016-11-25
801538201127157760,iPhone,This is Wallace. He'll be your chau-fur this evening. 12/10 eyes on the road Wallace https://t.co/p1RD39XjUe,12,10,Wallace,,https://pbs.twimg.com/media/Cx-itFWWIAAZu7l.jpg,1,Pembroke,0.550506,True,Cardigan,0.306612,True,Shetland_sheepdog,0.0542299999999999,True,7597,1923,21:29:33,2016-11-23
801167903437357056,iPhone,This is Milo. I would do terrible things for Milo. 13/10 https://t.co/R6wJyC2Tey,13,10,Milo,,https://pbs.twimg.com/media/Cx5R8wPVEAALa9r.jpg,1,cocker_spaniel,0.74022,True,Dandie_Dinmont,0.0616044999999999,True,English_setter,0.0413314,True,22474,5413,20:58:07,2016-11-22
801115127852503040,iPhone,This is Bones. He's being haunted by another doggo of roughly the same size. 12/10 deep breaths pupper everything's fine https://t.co/55Dqe0SJNj,12,10,Bones,doggo pupper,https://pbs.twimg.com/media/Cx4h7zHUsAAqaJd.jpg,1,dalmatian,0.823356,True,English_setter,0.0946018999999999,True,bluetick,0.0219534,True,7463,1957,17:28:25,2016-11-22
800751577355128832,iPhone,Say hello to Mauve and Murphy. They're rather h*ckin filthy. Preferred nap over bath. Both 12/10 https://t.co/4UwCTW3lXG,12,10,Mauve,,https://pbs.twimg.com/media/CxzXOyBW8AEu_Oi.jpg,2,cocker_spaniel,0.771984,True,miniature_poodle,0.0766528,True,toy_poodle,0.0396183,True,9835,2586,17:23:47,2016-11-21
800513324630806528,iPhone,This is Chef. Chef loves everyone and wants everyone to love each other. 11/10 https://t.co/ILHGs0e6Dm,11,10,Chef,,https://pbs.twimg.com/media/Cxv-nkJUoAAhzMt.jpg,1,Pembroke,0.8289040000000001,True,Cardigan,0.167373,True,Chihuahua,0.0007659339999999,True,12117,2768,01:37:04,2016-11-21
800388270626521089,iPhone,This is Doc. He takes time out of every day to worship our plant overlords. 12/10 quite the floofer https://t.co/azMneS6Ly5,12,10,Doc,floofer,https://pbs.twimg.com/media/CxuM3oZW8AEhO5z.jpg,2,golden_retriever,0.35986,True,Pembroke,0.194207,True,collie,0.154603,True,10313,2592,17:20:08,2016-11-20
800141422401830912,iPhone,This is Peaches. She's the ultimate selfie sidekick. Super sneaky tongue slip appreciated. 13/10 https://t.co/pbKOesr8Tg,13,10,Peaches,,https://pbs.twimg.com/media/CxqsX-8XUAAEvjD.jpg,3,golden_retriever,0.938048,True,kuvasz,0.0251195,True,Labrador_retriever,0.0229773,True,14163,2356,00:59:15,2016-11-20
799757965289017345,iPhone,This is Sobe. She's a h*ckin happy doggo. Only one leg tho. Must have good balance. 13/10 would smile back https://t.co/OiH8PaOxB1,13,10,Sobe,doggo,https://pbs.twimg.com/media/CxlPnoSUcAEXf1i.jpg,1,Border_collie,0.442534,True,collie,0.288684,True,Shetland_sheepdog,0.196399,True,7751,1974,23:35:32,2016-11-18
799422933579902976,iPhone,This is Longfellow (prolly sophisticated). He's a North Appalachian Oatzenjammer. Concerned about wrinkled feets. 12/10 would hug softly https://t.co/bpLuQuxzHZ,12,10,Longfellow,,https://pbs.twimg.com/media/Cxge6AdUQAAvXLB.jpg,1,miniature_pinscher,0.58363,True,redbone,0.276095,True,toy_terrier,0.0185500999999999,True,7459,1761,01:24:14,2016-11-18
799297110730567681,iPhone,This is Jeffrey. He's quite the jokester. Takes it too far sometimes. Still 11/10 would pet https://t.co/YDtZcAiMAf,11,10,Jeffrey,,https://pbs.twimg.com/media/CxeseRgUoAM_SQK.jpg,1,malamute,0.985028,True,Siberian_husky,0.00583442,True,Eskimo_dog,0.00544281,True,9148,2506,17:04:16,2016-11-17
799063482566066176,iPhone,This is Mister. He only wears the most fashionable af headwear. 11/10 h*ckin stylish https://t.co/BXJFKOVnJm,11,10,Mister,,https://pbs.twimg.com/media/CxbX_n2WIAAHaLS.jpg,2,Norfolk_terrier,0.334436,True,Norwich_terrier,0.231573,True,Australian_terrier,0.214203,True,7485,2308,01:35:54,2016-11-17
798933969379225600,iPhone,This is Iroh. He's in a predicament. 12/10 someone help him https://t.co/KJAKO2kXsL,12,10,Iroh,,https://pbs.twimg.com/media/CxZiLcLXUAApMVy.jpg,1,Siberian_husky,0.703224,True,Eskimo_dog,0.229351,True,malamute,0.0443508,True,12109,4088,17:01:16,2016-11-16
798925684722855936,iPhone,This is Shadow. He's a firm believer that they're all good dogs. H*ckin passionate about it too. 11/10 I stand with Shadow https://t.co/8yvpacwBcu,11,10,Shadow,,https://pbs.twimg.com/media/CxZaqh_WQAA7lY3.jpg,1,West_Highland_white_terrier,0.539463,True,cairn,0.184897,True,Norfolk_terrier,0.163024,True,6950,1332,16:28:21,2016-11-16
798209839306514432,iPhone,This is Cooper. His bow tie was too heavy for the front so he moved it to the side. Balanced af now. 13/10 https://t.co/jG1PAFkB81,13,10,Cooper,,https://pbs.twimg.com/media/CxPPnCYWIAAo_ao.jpg,1,Pekinese,0.524583,True,Shih-Tzu,0.102931,True,Pomeranian,0.0978931,True,9672,2386,17:03:50,2016-11-14
797545162159308800,iPhone,This is Cassie. She steals things. Guilt increases slightly each time. 12/10 would forgive almost immediately https://t.co/Ia19irLwyB,12,10,Cassie,,https://pbs.twimg.com/media/CxFzFAAUAAA5C9z.jpg,1,Pembroke,0.954089,True,Cardigan,0.0336439,True,papillon,0.00973566,True,13466,4545,21:02:38,2016-11-12
797236660651966464,iPhone,This is Pancake. She loves Batman and winks like a h*ckin champ. 12/10 real crowd pleaser https://t.co/6kqsAjJNhi,12,10,Pancake,,https://pbs.twimg.com/media/CxBafisWQAAtJ1X.jpg,2,collie,0.767005,True,Border_collie,0.100844,True,kelpie,0.0483681,True,18462,6051,00:36:46,2016-11-12
796865951799083009,iPhone,This is Tyr. He's just checking on you. Nifty af tongue slip. 12/10 would absolutely pet https://t.co/Jgnuiyvq06,12,10,Tyr,,https://pbs.twimg.com/media/Cw8JWZ2UsAAJOZ6.jpg,1,Cardigan,0.8391290000000001,True,Boston_bull,0.0806985,True,Pembroke,0.034505,True,7120,1810,00:03:42,2016-11-11
796759840936919040,iPhone,Say hello to Romeo. He was just told that it's too cold for the pool. H*ckin nonsense. 11/10 would help fill up https://t.co/6hx7ur6sNI,11,10,Romeo,,https://pbs.twimg.com/media/Cw6o1JQXcAAtP78.jpg,1,American_Staffordshire_terrier,0.463996,True,Staffordshire_bullterrier,0.155566,True,Weimaraner,0.137587,True,10889,2776,17:02:03,2016-11-10
796387464403357696,iPhone,This is Snicku. He's having trouble reading because he's a dog. Glasses only helped a little. Nap preferred. 12/10 would snug well https://t.co/cVLUasbKA5,12,10,Snicku,,https://pbs.twimg.com/media/Cw1WKu1UQAAvWsu.jpg,1,Pekinese,0.461164,True,Pomeranian,0.28865,True,Siamese_cat,0.052423,False,10170,3817,16:22:22,2016-11-09
796149749086875649,iPhone,This is Ruby. She just turned on the news. Officially terrified. 11/10 deep breaths Ruby https://t.co/y5KarNXWXt,11,10,Ruby,,https://pbs.twimg.com/media/Cwx99rpW8AMk_Ie.jpg,1,golden_retriever,0.600276,True,Labrador_retriever,0.140798,True,seat_belt,0.0873548,False,29719,13115,00:37:46,2016-11-09
796080075804475393,iPhone,This is Yogi. He's 98% floof. Snuggable af. 12/10 https://t.co/opoXKxmfFm,12,10,Yogi,,https://pbs.twimg.com/media/Cww-msrXcAAxm3K.jpg,1,chow,0.973846,True,Tibetan_mastiff,0.0141098999999999,True,gibbon,0.00235832,False,7782,2130,20:00:55,2016-11-08
796031486298386433,iPhone,This is Daisy. She's here to make your day better. 13/10 mission h*ckin successful https://t.co/PbgvuD0qIL,13,10,Daisy,,https://pbs.twimg.com/media/CwwSaWJWIAASuoY.jpg,1,golden_retriever,0.893775,True,Labrador_retriever,0.0701398,True,doormat,0.00841853,False,9973,3423,16:47:50,2016-11-08
795400264262053889,iPhone,This is Brody. He's trying to make the same face as the football. 12/10 https://t.co/2H4MfOGlpQ,12,10,Brody,,https://pbs.twimg.com/media/CwnUUGTWIAE8sFR.jpg,2,golden_retriever,0.925494,True,Labrador_retriever,0.0592408,True,tennis_ball,0.00449534,False,9286,2635,22:59:35,2016-11-06
795076730285391872,iPhone,This is Bailey. She loves going down slides but is very bad at it. Still 11/10 https://t.co/ivPWhspN3E,11,10,Bailey,,https://pbs.twimg.com/media/CwiuEJmW8AAZnit.jpg,2,gas_pump,0.676439,False,harvester,0.0499953,False,swing,0.0446596,False,14941,5008,01:33:58,2016-11-06
794926597468000259,iPhone,This is Mack. He's rather h*ckin sleepy. Exceptional ears. 12/10 would boop https://t.co/XRPvTPF0VH,12,10,Mack,,https://pbs.twimg.com/media/CwglhZVXgAAc3_w.jpg,1,teddy,0.569566,False,bath_towel,0.173745,False,toy_poodle,0.0376618,True,9415,2126,15:37:24,2016-11-05
794332329137291264,iPhone,This is Nimbus (like the cloud). He just bought this fancy af duck raincoat. Only protects one ear tho. 12/10 so h*ckin floofy https://t.co/SIQbb8c3AU,12,10,Nimbus,,https://pbs.twimg.com/media/CwYJBiHXgAQlvrh.jpg,1,Samoyed,0.988307,True,malamute,0.00490635,True,Great_Pyrenees,0.00290129,True,8878,2494,00:15:59,2016-11-04
794205286408003585,iPhone,This is Laika. She was a space pupper. The first space pupper actually. Orbited earth like a h*ckin boss. 14/10 hero af https://t.co/trSjgY3h4g,14,10,Laika,pupper,https://pbs.twimg.com/media/CwWVe_3WEAAHAvx.jpg,3,pedestal,0.66266,False,fountain,0.294827,False,brass,0.0203711,False,8538,3061,15:51:10,2016-11-03
793962221541933056,iPhone,This is Maximus. His face is stuck like that. Tragic really. Great tongue tho. 12/10 would pet firmly https://t.co/xIfrsMNLBR,12,10,Maximus,,https://pbs.twimg.com/media/CwS4aqZXUAAe3IO.jpg,1,Labrador_retriever,0.8616510000000001,True,golden_retriever,0.0444618,True,Staffordshire_bullterrier,0.0164967,True,15501,4502,23:45:19,2016-11-02
793845145112371200,iPhone,This is Clark. He was just caught wearing pants. 13/10 game-changing af https://t.co/2Xo19aPrG5,13,10,Clark,,https://pbs.twimg.com/media/CwRN8H6WgAASe4X.jpg,1,Old_English_sheepdog,0.7652770000000001,True,Bedlington_terrier,0.1127529999999999,True,Kerry_blue_terrier,0.0476616999999999,True,8516,1715,16:00:06,2016-11-02
793601777308463104,iPhone,This is Dobby. I can't stop looking at her feet. 12/10 would absolutely snug https://t.co/LhzPWv6rTv,12,10,Dobby,,https://pbs.twimg.com/media/CwNwmxvXEAEJ54Z.jpg,1,miniature_pinscher,0.538981,True,Chihuahua,0.21783,True,toy_terrier,0.0891487,True,7364,1500,23:53:02,2016-11-01
793500921481273345,iPhone,This is Fiona. She's an extremely mediocre copilot. Very distracting. Wink makes up for all the missed turns. 12/10 https://t.co/aF5MmpvPqN,12,10,Fiona,,https://pbs.twimg.com/media/CwMU34YWIAAz1nU.jpg,2,golden_retriever,0.3261219999999999,True,Labrador_retriever,0.219904,True,Chesapeake_Bay_retriever,0.163366,True,9822,2191,17:12:16,2016-11-01
793286476301799424,iPhone,This is Moreton. He's the Good Boy Who Lived. 13/10 magical as h*ck https://t.co/rLHGx3VAF3,13,10,Moreton,,https://pbs.twimg.com/media/CwJR1okWIAA6XMp.jpg,1,Afghan_hound,0.2746369999999999,True,borzoi,0.142204,True,doormat,0.109677,False,22679,8438,03:00:09,2016-11-01
793271401113350145,iPhone,Meet Dave. It's his favorite day of the year. He gets to fulfill his dream of being a dinosaur. 12/10 inspirational af https://t.co/MgQSdfZGPN,12,10,Dave,,https://pbs.twimg.com/media/CwJEIKTWYAAvL-T.jpg,1,Siberian_husky,0.2316949999999999,True,Eskimo_dog,0.206749,True,Pembroke,0.0701195,True,7998,2216,02:00:14,2016-11-01
793241302385262592,iPhone,This is Tucker. He's out here bustin h*ckin ghosts. 13/10 dedicated af https://t.co/Ap477GhwXt,13,10,Tucker,,https://pbs.twimg.com/media/CwIougTWcAAMLyq.jpg,1,golden_retriever,0.559308,True,Labrador_retriever,0.3902219999999999,True,cocker_spaniel,0.0363157,True,9699,3018,00:00:38,2016-11-01
793226087023144960,iPhone,"This is Juno. She spooked me up real good, but only to get my attention. Above average handwriting for a dog I think. 11/10 https://t.co/hFxxBCWlwj",11,10,Juno,,https://pbs.twimg.com/media/CwIa5CjW8AErZgL.jpg,1,wire-haired_fox_terrier,0.456047,True,Lakeland_terrier,0.273428,True,English_springer,0.0836433,True,9058,2675,23:00:11,2016-10-31
793210959003287553,iPhone,This is Maude. She's the h*ckin happiest wasp you've ever seen. 10/10 would pet with caution https://t.co/etL8FHBrh8,10,10,Maude,,https://pbs.twimg.com/media/CwINKJeW8AYHVkn.jpg,1,doormat,0.874431,False,French_bulldog,0.0187590999999999,True,Boston_bull,0.0151344,True,8231,2563,22:00:04,2016-10-31
793195938047070209,iPhone,Say hello to Lily. She's pupset that her costume doesn't fit as well as last year. 12/10 poor puppo https://t.co/YSi6K1firY,12,10,Lily,puppo,https://pbs.twimg.com/media/CwH_foYWgAEvTyI.jpg,2,Labrador_retriever,0.654762,True,golden_retriever,0.0741,True,Chihuahua,0.0423393,True,14089,5196,21:00:23,2016-10-31
793180763617361921,iPhone,This is Newt. He's a strawberry. 11/10 https://t.co/2VhmlwxA1Q,11,10,Newt,,https://pbs.twimg.com/media/CwHxsdYVMAAqGCJ.jpg,1,Lakeland_terrier,0.266824,True,Irish_terrier,0.218783,True,Airedale,0.13296,True,6398,1835,20:00:05,2016-10-31
