tweet_id,source,text,rating_numerator,rating_denominator,name,stage,jpg_url,img_num,p1,p1_conf,p1_dog,p2,p2_conf,p2_dog,p3,p3_conf,p3_dog,favorite_count,retweet_count,post_time,post_date
892420643555336193,iPhone,This is Phineas. He's a mystical boy. Only ever appears in the hole of a donut. 13/10 https://t.co/MgUWQ76dJU,13,10,Phineas,,https://pbs.twimg.com/media/DGKD1-bXoAAIAUK.jpg,1,orange,0.0970486,False,bagel,0.0858511,False,banana,0.07611,False,32866,6875,16:23:56,2017-08-01
892177421306343426,iPhone,"This is Tilly. She's just checking pup on you. Hopes you're doing ok. If not, she's available for pats, snugs, boops, the whole bit. 13/10 https://t.co/0Xxu71qeIV",13,10,Tilly,,https://pbs.twimg.com/media/DGGmoV4XsAAUL6n.jpg,1,Chihuahua,0.323581,True,Pekinese,0.0906465,True,papillon,0.0689569,True,28395,5177,00:17:27,2017-08-01
891815181378084864,iPhone,This is Archie. He is a rare Norwegian Pouncing Corgo. Lives in the tall grass. You never know when one may strike. 12/10 https://t.co/wUnZnhtVJB,12,10,Archie,,https://pbs.twimg.com/media/DGBdLU1WsAANxJ9.jpg,1,Chihuahua,0.716012,True,malamute,0.078253,True,kelpie,0.0313789,True,21341,3420,00:18:03,2017-07-31
891689557279858688,iPhone,This is Darla. She commenced a snooze mid meal. 13/10 happens to the best of us https://t.co/tD36da7qLQ,13,10,Darla,,https://pbs.twimg.com/media/DF_q7IAWsAEuuN8.jpg,1,paper_towel,0.1702779999999999,False,Labrador_retriever,0.1680859999999999,True,spatula,0.0408359,False,35831,7082,15:58:51,2017-07-30
891327558926688256,iPhone,"This is Franklin. He would like you to stop calling him ""cute."" He is a very fierce shark and should be respected as such. 12/10 #BarkWeek https://t.co/AtUZn91f7f",12,10,Franklin,,https://pbs.twimg.com/media/DF6hr6BUMAAzZgT.jpg,2,basset,0.555712,True,English_springer,0.2257699999999999,True,German_short-haired_pointer,0.175219,True,34278,7591,16:00:24,2017-07-29
890971913173991426,iPhone,"Meet Jax. He enjoys ice cream so much he gets nervous around it. 13/10 help Jax enjoy more things by clicking below

https://t.co/Zr4hWfAs1H https://t.co/tVJBRMnhxl",13,10,Jax,,https://pbs.twimg.com/media/DF1eOmZXUAALUcq.jpg,1,Appenzeller,0.341703,True,Border_collie,0.199287,True,ice_lolly,0.193548,False,10063,1620,16:27:12,2017-07-28
890609185150312448,iPhone,This is Zoey. She doesn't want to be one of the scary sharks. Just wants to be a snuggly pettable boatpet. 13/10 #BarkWeek https://t.co/9TwLuAGH0b,13,10,Zoey,,https://pbs.twimg.com/media/DFwUU__XcAEpyXI.jpg,1,Irish_terrier,0.4875739999999999,True,Irish_setter,0.193054,True,Chesapeake_Bay_retriever,0.118184,True,23790,3553,16:25:51,2017-07-27
890240255349198849,iPhone,This is Cassie. She is a college pup. Studying international doggo communication and stick theory. 14/10 so elegant much sophisticate https://t.co/t1bfwz5S2A,14,10,Cassie,doggo,https://pbs.twimg.com/media/DFrEyVuW0AAO3t9.jpg,1,Pembroke,0.511319,True,Cardigan,0.451038,True,Chihuahua,0.0292482,True,27120,5982,15:59:51,2017-07-26
890006608113172480,iPhone,This is Koda. He is a South Australian deckshark. Deceptively deadly. Frighteningly majestic. 13/10 would risk a petting #BarkWeek https://t.co/dVPW0B0Mme,13,10,Koda,,https://pbs.twimg.com/media/DFnwSY4WAAAMliS.jpg,1,Samoyed,0.957979,True,Pomeranian,0.0138835,True,chow,0.00816748,True,26258,6028,00:31:25,2017-07-26
889880896479866881,iPhone,This is Bruno. He is a service shark. Only gets out of the water to assist you. 13/10 terrifyingly good boy https://t.co/u1XPQMl29g,13,10,Bruno,,https://pbs.twimg.com/media/DFl99B1WsAITKsg.jpg,1,French_bulldog,0.377417,True,Labrador_retriever,0.151317,True,muzzle,0.0829811,False,23820,4076,16:11:53,2017-07-25
889638837579907072,iPhone,This is Ted. He does his best. Sometimes that's not enough. But it's ok. 12/10 would assist https://t.co/f8dEDcrKSR,12,10,Ted,,https://pbs.twimg.com/media/DFihzFfXsAYGDPR.jpg,1,French_bulldog,0.99165,True,boxer,0.00212864,True,Staffordshire_bullterrier,0.00149818,True,22999,3647,00:10:02,2017-07-25
889531135344209921,iPhone,This is Stuart. He's sporting his favorite fanny pack. Secretly filled with bones only. 13/10 puppared puppo #BarkWeek https://t.co/y70o6h3isq,13,10,Stuart,puppo,https://pbs.twimg.com/media/DFg_2PVW0AEHN3p.jpg,1,golden_retriever,0.953442,True,Labrador_retriever,0.0138341,True,redbone,0.00795775,True,12967,1852,17:02:04,2017-07-24
889278841981685760,iPhone,This is Oliver. You're witnessing one of his many brutal attacks. Seems to be playing with his victim. 13/10 fr*ckin frightening #BarkWeek https://t.co/WpHvrQedPb,13,10,Oliver,,https://pbs.twimg.com/ext_tw_video_thumb/889278779352338437/pu/img/VlbFB3v8H8VwzVNY.jpg,1,whippet,0.626152,True,borzoi,0.194742,True,Saluki,0.0273507,True,21427,4357,00:19:32,2017-07-24
888917238123831296,iPhone,This is Jim. He found a fren. Taught him how to sit like the good boys. 12/10 for both https://t.co/chxruIOUJN,12,10,Jim,,https://pbs.twimg.com/media/DFYRgsOUQAARGhO.jpg,1,golden_retriever,0.714719,True,Tibetan_mastiff,0.1201839999999999,True,Labrador_retriever,0.1055059999999999,True,24886,3686,00:22:39,2017-07-23
888804989199671297,iPhone,This is Zeke. He has a new stick. Very proud of it. Would like you to throw it for him without taking it. 13/10 would do my best https://t.co/HTQ77yNQ5K,13,10,Zeke,,https://pbs.twimg.com/media/DFWra-3VYAA2piG.jpg,1,golden_retriever,0.46976,True,Labrador_retriever,0.184172,True,English_setter,0.0734817,True,21807,3458,16:56:37,2017-07-22
888554962724278272,iPhone,This is Ralphus. He's powering up. Attempting maximum borkdrive. 13/10 inspirational af https://t.co/YnYAFCTTiK,13,10,Ralphus,,https://pbs.twimg.com/media/DFTH_O-UQAACu20.jpg,3,Siberian_husky,0.700377,True,Eskimo_dog,0.166511,True,malamute,0.111411,True,16835,2837,00:23:06,2017-07-22
888078434458587136,iPhone,This is Gerald. He was just told he didn't get the job he interviewed for. A h*ckin injustice. 12/10 didn't want the job anyway https://t.co/DK7iDPfuRX,12,10,Gerald,,https://pbs.twimg.com/media/DFMWn56WsAAkA7B.jpg,1,French_bulldog,0.995026,True,pug,0.000931908,True,bull_mastiff,0.000903211,True,18552,2841,16:49:33,2017-07-20
887705289381826560,iPhone,This is Jeffrey. He has a monopoly on the pool noodles. Currently running a 'boop for two' midweek sale. 13/10 h*ckin strategic https://t.co/PhrUk20Q64,13,10,Jeffrey,,https://pbs.twimg.com/media/DFHDQBbXgAEqY7t.jpg,1,basset,0.821664,True,redbone,0.0875815,True,Weimaraner,0.0262364,True,25808,4439,16:06:48,2017-07-19
887473957103951883,iPhone,This is Canela. She attempted some fancy porch pics. They were unsuccessful. 13/10 someone help her https://t.co/cLyzpcUcMX,13,10,Canela,,https://pbs.twimg.com/media/DFDw2tyUQAAAFke.jpg,2,Pembroke,0.809197,True,Rhodesian_ridgeback,0.05495,True,beagle,0.0389148,True,58565,14752,00:47:34,2017-07-19
886983233522544640,iPhone,This is Maya. She's very shy. Rarely leaves her cup. 13/10 would find her an environment to thrive in https://t.co/I6oNy0CgiT,13,10,Maya,,https://pbs.twimg.com/media/DE8yicJW0AAAvBJ.jpg,2,Chihuahua,0.793469,True,toy_terrier,0.143528,True,can_opener,0.0322529,False,29528,6184,16:17:36,2017-07-17
886736880519319552,iPhone,"This is Mingus. He's a wonderful father to his smol pup. Confirmed 13/10, but he needs your help

https://t.co/bVi0Yr4Cff https://t.co/ISvKOSkd5b",13,10,Mingus,,https://pbs.twimg.com/media/DE5Se8FXcAAJFx4.jpg,1,kuvasz,0.309706,True,Great_Pyrenees,0.186136,True,Dandie_Dinmont,0.0863463,True,10213,2575,23:58:41,2017-07-16
886680336477933568,iPhone,This is Derek. He's late for a dog meeting. 13/10 pet...al to the metal https://t.co/BCoWue0abA,13,10,Derek,,https://pbs.twimg.com/media/DE4fEDzWAAAyHMM.jpg,1,convertible,0.738995,False,sports_car,0.139952,False,car_wheel,0.0441726999999999,False,19148,3665,20:14:00,2017-07-16
886366144734445568,iPhone,This is Roscoe. Another pupper fallen victim to spontaneous tongue ejections. Get the BlepiPen immediate. 12/10 deep breaths Roscoe https://t.co/RGE08MIJox,12,10,Roscoe,pupper,https://pbs.twimg.com/media/DE0BTnQUwAApKEH.jpg,1,French_bulldog,0.999201,True,Chihuahua,0.000361178,True,Boston_bull,7.55616e-05,True,17993,2571,23:25:31,2017-07-15
886258384151887873,iPhone,This is Waffles. His doggles are pupside down. Unsure how to fix. 13/10 someone assist Waffles https://t.co/xZDA9Qsq1O,13,10,Waffles,,https://pbs.twimg.com/media/DEyfTG4UMAE4aE9.jpg,1,pug,0.943575,True,shower_cap,0.0252856,False,Siamese_cat,0.00284892,False,23835,5168,16:17:19,2017-07-15
885984800019947520,iPhone,Viewer discretion advised. This is Jimbo. He will rip ur finger right h*ckin off. Other dog clearly an accessory. 12/10 pls pet with caution https://t.co/BuveP0uMF1,12,10,Jimbo,,https://pbs.twimg.com/media/DEumeWWV0AA-Z61.jpg,1,Blenheim_spaniel,0.972494,True,Shih-Tzu,0.00663012,True,Bernese_mountain_dog,0.00623915,True,27818,5502,22:10:11,2017-07-14
885528943205470208,iPhone,This is Maisey. She fell asleep mid-excavation. Happens to the best of us. 13/10 would pat noggin approvingly https://t.co/tp1kQ8i9JF,13,10,Maisey,,https://pbs.twimg.com/media/DEoH3yvXgAAzQtS.jpg,1,pug,0.369275,True,Labrador_retriever,0.265835,True,kuvasz,0.134697,True,30680,5228,15:58:47,2017-07-13
884925521741709313,iPhone,"This is Earl. He found a hat. Nervous about what you think of it. 12/10 it's delightful, Earl https://t.co/MYJvdlNRVa",12,10,Earl,,https://pbs.twimg.com/media/DEfjEaNXkAAtPlj.jpg,1,Italian_greyhound,0.259916,True,American_Staffordshire_terrier,0.198451,True,Staffordshire_bullterrier,0.127725,True,65467,14718,00:01:00,2017-07-12
884876753390489601,iPhone,This is Lola. It's her first time outside. Must test the earth and taste the atmosphere. 13/10 you're doing great Lola https://t.co/74TKAUsLkO,13,10,Lola,,https://pbs.twimg.com/media/DEe2tZXXkAAwyX3.jpg,1,chow,0.822103,True,Norwich_terrier,0.106075,True,Norfolk_terrier,0.0373485,True,23673,4575,20:47:12,2017-07-11
884562892145688576,iPhone,This is Kevin. He's just so happy. 13/10 what is your secret Kevin https://t.co/1r4MFCbCX5,13,10,Kevin,,https://pbs.twimg.com/media/DEaZQkfXUAEC7qB.jpg,1,pug,0.5464060000000001,True,French_bulldog,0.404291,True,Brabancon_griffon,0.0440019,True,20685,3823,00:00:02,2017-07-11
884162670584377345,iPhone,Meet Yogi. He doesn't have any important dog meetings today he just enjoys looking his best at all times. 12/10 for dangerously dapper doggo https://t.co/YSI00BzTBZ,12,10,Yogi,doggo,https://pbs.twimg.com/media/DEUtQbzW0AUTv_o.jpg,1,German_shepherd,0.707046,True,malinois,0.199396,True,Norwegian_elkhound,0.0491476,True,17396,2456,21:29:42,2017-07-09
883838122936631299,iPhone,This is Noah. He can't believe someone made this mess. Got the vacuum out for you though. Offered to help clean pup. 12/10 super good boy https://t.co/V85xujjDDY,12,10,Noah,,https://pbs.twimg.com/media/DEQGFgAXUAAEvfi.jpg,1,Doberman,0.610946,True,miniature_pinscher,0.299603,True,kelpie,0.0630203,True,18573,2805,00:00:04,2017-07-09
883482846933004288,iPhone,"This is Bella. She hopes her smile made you smile. If not, she is also offering you her favorite monkey. 13.5/10 https://t.co/qjrljjt948",5,10,Bella,,https://pbs.twimg.com/media/DELC9dZXUAADqUk.jpg,1,golden_retriever,0.943082,True,Labrador_retriever,0.032409,True,kuvasz,0.00550072,True,38992,8097,00:28:19,2017-07-08
883360690899218434,iPhone,Meet Grizzwald. He may be the floofiest floofer I ever did see. Lost eyes saving a schoolbus from a volcano erpuption. 13/10 heroic as h*ck https://t.co/rf661IFEYP,13,10,Grizzwald,floofer,https://pbs.twimg.com/media/DEJT3FeXoAAtwUy.jpg,1,chow,0.987997,True,Tibetan_mastiff,0.00709872,True,Newfoundland,0.00214033,True,19347,3018,16:22:55,2017-07-07
882992080364220416,iPhone,This is Rusty. He wasn't ready for the first pic. Clearly puppared for the second. 13/10 confirmed great boy https://t.co/tyER0KpdXj,13,10,Rusty,,https://pbs.twimg.com/media/DEEEnIqXYAAiJh_.jpg,1,Eskimo_dog,0.4667779999999999,True,Siberian_husky,0.406044,True,dingo,0.0734143999999999,False,20396,3184,15:58:11,2017-07-06
882762694511734784,iPhone,This is Gus. He's quite the cheeky pupper. Already perfected the disinterested wink. 12/10 would let steal my girl https://t.co/D43I96SlVu,12,10,Gus,pupper,https://pbs.twimg.com/media/DEAz_HHXsAA-p_z.jpg,1,Labrador_retriever,0.85005,True,Chesapeake_Bay_retriever,0.074257,True,flat-coated_retriever,0.0155793999999999,True,24103,4025,00:46:41,2017-07-06
882627270321602560,iPhone,This is Stanley. He has his first swim lesson today. Doggle straps adjusted. Ready to go. 13/10 Phelps is nervous (IG: stanleythe_corgi) https://t.co/Nx52PGwH94,13,10,Stanley,,https://pbs.twimg.com/media/DD-40X3WAAAJPU5.jpg,1,Pembroke,0.542982,True,Chihuahua,0.251988,True,Cardigan,0.107699,True,23867,4960,15:48:34,2017-07-05
882268110199369728,iPhone,This is Alfy. You're witnessing his first watermelon experience. I think it was a success. 13/10 happy 4th Alfy 🇺🇸 https://t.co/fYP5RlutfA,13,10,Alfy,,https://pbs.twimg.com/media/DD5yKdPW0AArzX8.jpg,1,golden_retriever,0.762211,True,Labrador_retriever,0.0989848999999999,True,cocker_spaniel,0.0171995,True,38153,9410,16:01:23,2017-07-04
882045870035918850,iPhone,"This is Koko. Her owner, inspired by Barney, recently built a cart for her to use during walks if she got tired. 13/10 rest easy Koko https://t.co/zeDpnsKX7w",13,10,Koko,,https://pbs.twimg.com/media/DD2oCl2WAAEI_4a.jpg,1,web_site,0.949591,False,dhole,0.0173258,False,golden_retriever,0.00694063,True,24951,4002,01:18:17,2017-07-04
881906580714921986,iPhone,This is Rey. He's a Benebop Cumberfloof. 12/10 dangerously pettable https://t.co/503CgWbhxQ,12,10,Rey,,https://pbs.twimg.com/media/DD0pWm9XcAAeSBL.jpg,1,Weimaraner,0.291539,True,Chesapeake_Bay_retriever,0.278966,True,koala,0.127017,False,20803,2789,16:04:48,2017-07-03
881666595344535552,iPhone,This is Gary. He couldn't miss this puppertunity for a selfie. Flawless focusing skills. 13/10 would boop intensely https://t.co/7CSWCl8I6s,13,10,Gary,,https://pbs.twimg.com/media/DDxPFwbWAAEbVVR.jpg,1,Saluki,0.529012,True,Afghan_hound,0.250003,True,golden_retriever,0.160739,True,43231,8765,00:11:11,2017-07-03
881268444196462592,iPhone,Meet Elliot. He's a Canadian Forrest Pup. Unusual number of antlers for a dog. Sneaky tongue slip to celebrate #Canada150. 12/10 would pet https://t.co/cgwJwowTMC,12,10,Elliot,,https://pbs.twimg.com/media/DDrk-f9WAAI-WQv.jpg,1,tusker,0.473303,False,Indian_elephant,0.245646,False,ibex,0.0556607,False,19816,4384,21:49:04,2017-07-01
880935762899988482,iPhone,This is Louis. He's crossing. It's a big deal. 13/10 h*ckin breathtaking https://t.co/D0wb1GlKAt,13,10,Louis,,https://pbs.twimg.com/media/DDm2Z5aXUAEDS2u.jpg,1,street_sign,0.251801,False,umbrella,0.115123,False,traffic_light,0.0695338,False,14561,2280,23:47:07,2017-06-30
880465832366813184,iPhone,This is Bella. She had her first beach experience this morning. Complete success. 12/10 would perform a sandy boop https://t.co/4VsFysDmiw,12,10,Bella,,https://pbs.twimg.com/media/DDgK-J4XUAIEV9W.jpg,1,golden_retriever,0.913255,True,Labrador_retriever,0.0263286,True,cocker_spaniel,0.00937082,True,24333,5121,16:39:47,2017-06-29
880221127280381952,iPhone,Meet Jesse. He's a Fetty Woof. His tongue ejects without warning. A true bleptomaniac. 12/10 would snug well https://t.co/fUod0tVmvK,12,10,Jesse,,https://pbs.twimg.com/media/DDcscbXU0AIfDzs.jpg,1,Chihuahua,0.238525,True,meerkat,0.104256,False,clumber,0.0525802999999999,True,22956,3403,00:27:25,2017-06-29
879862464715927552,iPhone,This is Romeo. He would like to do an entrance. Requesting your immediate assistance. 13/10 https://t.co/Qh5aEkRQm9,13,10,Romeo,,https://pbs.twimg.com/media/DDXmPrbWAAEKMvy.jpg,3,basset,0.813507,True,beagle,0.146654,True,cocker_spaniel,0.00948502,True,19122,2870,00:42:13,2017-06-28
879492040517615616,iPhone,This is Bailey. He thinks you should measure ear length for signs of growth instead. 12/10 https://t.co/IxM9IMKQq8,12,10,Bailey,,https://pbs.twimg.com/media/DDSVWMvXsAEgmMK.jpg,1,German_short-haired_pointer,0.479896,True,vizsla,0.1243529999999999,True,bath_towel,0.0733202,False,20078,2581,00:10:17,2017-06-27
879415818425184262,iPhone,This is Duddles. He did an attempt. 13/10 someone help him (vid by Georgia Felici) https://t.co/UDT7ZkcTgY,13,10,Duddles,,https://pbs.twimg.com/ext_tw_video_thumb/879415784908390401/pu/img/cX7XI1TnUsseGET5.jpg,1,English_springer,0.383404,True,Boston_bull,0.134967,True,Cardigan,0.110481,True,90372,36704,19:07:24,2017-06-26
879376492567855104,iPhone,This is Jack AKA Stephen Furry. You're not scoring on him. Unless he slips down the slide. 12/10 would happily get blocked by https://t.co/0gOi601EAa,12,10,Jack,,https://pbs.twimg.com/media/DDQsQGFV0AAw6u9.jpg,1,tricycle,0.663601,False,Labrador_retriever,0.0334961,True,Pembroke,0.0188266,True,14438,2607,16:31:08,2017-06-26
879050749262655488,iPhone,This is Steven. He has trouble relating to other dogs. Quite shy. Neck longer than average. Tropical probably. 11/10 would still pet https://t.co/2mJCDEJWdD,11,10,Steven,,https://pbs.twimg.com/media/DDMD_phXoAQ1qf0.jpg,1,tabby,0.311861,False,window_screen,0.169123,False,Egyptian_cat,0.132932,False,19220,3866,18:56:45,2017-06-25
879008229531029506,iPhone,This is Beau. That is Beau's balloon. He takes it everywhere. 13/10 would protect at all costs https://t.co/YDtpCjIPKN,13,10,Beau,,https://pbs.twimg.com/media/DDLdUrqXYAMOVzY.jpg,1,vizsla,0.960513,True,miniature_pinscher,0.00943065,True,American_Staffordshire_terrier,0.0087113,True,16284,2200,16:07:47,2017-06-25
878776093423087618,iPhone,This is Snoopy. He's a proud #PrideMonthPuppo. Impeccable handwriting for not having thumbs. 13/10 would love back #PrideMonth https://t.co/lNZwgNO4gS,13,10,Snoopy,puppo,https://pbs.twimg.com/media/DDIKMXzW0AEibje.jpg,2,Italian_greyhound,0.734684,True,whippet,0.1504869999999999,True,Ibizan_hound,0.0397246,True,16579,3368,00:45:22,2017-06-25
878281511006478336,iPhone,"Meet Shadow. In an attempt to reach maximum zooming borkdrive, he tore his ACL. Still 13/10 tho. Help him out below

https://t.co/245xJJElsY https://t.co/lUiQH219v6",13,10,Shadow,,https://pbs.twimg.com/media/DDBIX9QVYAAohGa.jpg,1,basset,0.32042,True,collie,0.215975,True,Appenzeller,0.1285069999999999,True,6582,1051,16:00:04,2017-06-23
878057613040115712,iPhone,This is Emmy. She was adopted today. Massive round of pupplause for Emmy and her new family. 14/10 for all involved https://t.co/cwtWnHMVpe,14,10,Emmy,,https://pbs.twimg.com/media/DC98vABUIAA97pz.jpg,1,French_bulldog,0.839097,True,Boston_bull,0.0787993999999999,True,toy_terrier,0.0152433999999999,True,35865,5614,01:10:23,2017-06-23
877736472329191424,iPhone,This is Aja. She was just told she's a good dog. Suspicions confirmed. 13/10 would tell again https://t.co/lsPyyAiF1r,13,10,Aja,,https://pbs.twimg.com/media/DC5YqoQW0AArOLH.jpg,2,Chesapeake_Bay_retriever,0.8379559999999999,True,Labrador_retriever,0.0620342,True,Weimaraner,0.0405991,True,67392,15511,03:54:17,2017-06-22
877556246731214848,iPhone,This is Penny. She's both pupset and fired pup. Not pleased w your barbaric attempts at cleanliness. 12/10 would enjoy more shampoo options https://t.co/OYdDlfOGXP,12,10,Penny,,https://pbs.twimg.com/media/DC20wEcW0AAf59m.jpg,1,basset,0.995368,True,Welsh_springer_spaniel,0.00193621,True,bathtub,0.000467919,False,19315,3103,15:58:08,2017-06-21
877316821321428993,iPhone,"Meet Dante. At first he wasn't a fan of his new raincoat, then he saw his reflection. H*ckin handsome. 13/10 for water resistant good boy https://t.co/SHRTIo5pxc",13,10,Dante,,https://pbs.twimg.com/media/DCza_vtXkAQXGpC.jpg,1,Saluki,0.5099670000000001,True,Italian_greyhound,0.0904973,True,golden_retriever,0.0794058,True,23477,4262,00:06:44,2017-06-21
877201837425926144,iPhone,This is Nelly. He graduated with his dogtorate today. Wants to know if you're proud of him. 12/10 would give congratulatory boop https://t.co/4g4cfj3P4Y,12,10,Nelly,,https://pbs.twimg.com/media/DCxyahJWsAAddSC.jpg,1,Pembroke,0.93112,True,Cardigan,0.0686982,True,basenji,8.17379e-05,True,23186,4531,16:29:50,2017-06-20
876838120628539392,iPhone,This is Ginger. She's having a ruff Monday. Too many pupper things going on. H*ckin exhausting. 12/10 would snug passionately https://t.co/j211oCDRs6,12,10,Ginger,pupper,https://pbs.twimg.com/media/DCsnnZsVwAEfkyi.jpg,1,bloodhound,0.575751,True,redbone,0.24097,True,Tibetan_mastiff,0.0889348,True,17668,2755,16:24:33,2017-06-19
876484053909872640,iPhone,This is Benedict. He wants to thank you for this delightful urban walk. Hopes you know he loves you. 13/10 super duper good boy https://t.co/26BXueUgbs,13,10,Benedict,,https://pbs.twimg.com/media/DCnll_dUQAAkBdG.jpg,1,golden_retriever,0.874566,True,Irish_terrier,0.0373542,True,chow,0.0167235999999999,True,16071,1958,16:57:37,2017-06-18
876120275196170240,iPhone,"Meet Venti, a seemingly caffeinated puppoccino. She was just informed the weekend would include walks, pats and scritches. 13/10 much excite https://t.co/ejExJFq3ek",13,10,Venti,,https://pbs.twimg.com/media/DCiavj_UwAAcXep.jpg,1,Bernese_mountain_dog,0.534327,True,Saint_Bernard,0.346312,True,Greater_Swiss_Mountain_dog,0.0949327,True,23920,3836,16:52:05,2017-06-17
875747767867523072,iPhone,"This is Goose. He's a womanizer. Cheeky as h*ck, but also deep. Tongue slip game on another level. 13/10 will steal your girl https://t.co/V2WlACRJCN",13,10,Goose,,https://pbs.twimg.com/media/DCdH8YpUQAAiEbL.jpg,1,Labrador_retriever,0.799551,True,Chesapeake_Bay_retriever,0.179975,True,vizsla,0.0046176,True,21448,3510,16:11:53,2017-06-16
875144289856114688,iPhone,Meet Nugget and Hank. Nugget took Hank's bone. Hank is wondering if you would please return it to him. Both 13/10 would not intervene https://t.co/ogith9ejNj,13,10,Nugget,,https://pbs.twimg.com/ext_tw_video_thumb/875144175078957056/pu/img/BRi_l7vUdpb93Knf.jpg,1,Siberian_husky,0.245048,True,Pembroke,0.223716,True,dingo,0.160753,False,18851,4080,00:13:52,2017-06-15
874680097055178752,iPhone,Meet Cash. He hath acquired a stick. A very good stick tbh. 12/10 would pat head approvingly https://t.co/lZhtizkURD,12,10,Cash,,https://pbs.twimg.com/media/DCN85nGUwAAzG_q.jpg,1,Labrador_retriever,0.836052,True,Staffordshire_bullterrier,0.0470690999999999,True,beagle,0.0360071,True,23808,3841,17:29:20,2017-06-13
874296783580663808,iPhone,This is Jed. He may be the fanciest pupper in the game right now. Knows it too. 13/10 would sign modeling contract https://t.co/0YplNnSMEm,13,10,Jed,pupper,https://pbs.twimg.com/media/DCIgSR0XgAANEOY.jpg,1,cocker_spaniel,0.437216,True,miniature_poodle,0.2771909999999999,True,toy_poodle,0.157402,True,22300,3412,16:06:11,2017-06-12
874012996292530176,iPhone,"This is Sebastian. He can't see all the colors of the rainbow, but he can see that this flag makes his human happy. 13/10 #PrideMonth puppo https://t.co/XBE0evJZ6V",13,10,Sebastian,puppo,https://pbs.twimg.com/media/DCEeLxjXsAAvNSM.jpg,2,Cardigan,0.806674,True,Pembroke,0.116622,True,kelpie,0.0491819,True,29197,8416,21:18:31,2017-06-11
873213775632977920,iPhone,"This is Sierra. She's one precious pupper. Absolute 12/10. Been in and out of ICU her whole life. Help Sierra below

https://t.co/Xp01EU3qyD https://t.co/V5lkvrGLdQ",12,10,Sierra,pupper,https://pbs.twimg.com/media/DB5HTBGXUAE0TiK.jpg,1,vizsla,0.6197819999999999,True,bloodhound,0.338069,True,Chesapeake_Bay_retriever,0.0126763,True,6137,1306,16:22:42,2017-06-09
872620804844003328,iPhone,This is Monkey. She's supporting owners everywhere with her fancy #PrideMonth bandana. 13/10 love is love is love... https://t.co/lUcpnZDPz9,13,10,Monkey,,https://pbs.twimg.com/media/DBwr_hzXkAEnZBW.jpg,1,cocker_spaniel,0.513191,True,Sussex_spaniel,0.159088,True,standard_poodle,0.149509,True,17704,3004,01:06:27,2017-06-08
872122724285648897,iPhone,This is Kody. He's a baller. Wishes he was a little bit taller. Double dribbles often. Still 12/10 would happily get dunked on https://t.co/PKSpmiefwN,12,10,Kody,,https://pbs.twimg.com/media/DBpm-5UXcAUeCru.jpg,1,basketball,0.808396,False,pug,0.0667363,True,dalmatian,0.0545697999999999,True,29369,6691,16:07:15,2017-06-06
871879754684805121,iPhone,Say hello to Lassie. She's celebrating #PrideMonth by being a splendid mix of astute and adorable. Proudly supupporting her owner. 13/10 https://t.co/uK6PNyeh9w,13,10,Lassie,,https://pbs.twimg.com/media/DBmKAmBXUAE-pQ-.jpg,1,Shetland_sheepdog,0.969171,True,collie,0.0182607,True,Pomeranian,0.00851534,True,32104,9082,00:01:46,2017-06-06
871762521631449091,iPhone,This is Rover. As part of pupper protocol he had to at least attempt to eat the plant. Confirmed not tasty. Needs peanut butter. 12/10 https://t.co/AiVljI6QCg,12,10,Rover,pupper,https://pbs.twimg.com/media/DBkfY58XcAEdzZy.jpg,2,Labrador_retriever,0.921393,True,golden_retriever,0.064608,True,bloodhound,0.00338337,True,17346,2913,16:15:56,2017-06-05
871515927908634625,iPhone,This is Napolean. He's a Raggedy East Nicaraguan Zoom Zoom. Runs on one leg. Built for deception. No eyes. Good with kids. 12/10 great doggo https://t.co/PR7B7w1rUw,12,10,Napolean,doggo,https://pbs.twimg.com/media/DBg_HT9WAAEeIMM.jpg,2,komondor,0.974781,True,briard,0.0200412999999999,True,swab,0.00322824,False,17360,2880,23:56:03,2017-06-04
871032628920680449,iPhone,"This is Boomer. He's doing an advanced water takeoff. The opposite of Sully. Ears for control, mlem for style. 13/10 simply breathtaking https://t.co/noNpY2Laoo",13,10,Boomer,,https://pbs.twimg.com/media/DBaHi3YXgAE6knM.jpg,1,kelpie,0.398053,True,macaque,0.0689549,False,dingo,0.0506018,False,19592,3164,15:55:36,2017-06-03
870656317836468226,iPhone,"This is Cody. He zoomed too aggressively and tore his ACL. Happens to the best of us. Still 13/10

Help Cody here: https://t.co/4hxnDOt1CV https://t.co/42ryYRQ2Q4",13,10,Cody,,https://pbs.twimg.com/media/DBUxSSTXsAA-Jn1.jpg,4,Pembroke,0.945495,True,Cardigan,0.0458755,True,beagle,0.00432943,True,10555,2159,15:00:16,2017-06-02
